index,published,keyword,domain,language,valid,title,description,url,image,archive,content,quote
d2aa935caaaf0ab1fba0252c1af62162,2025-11-02T13:46:30Z,'earthquake',rollingout.com,en,1.0,3.2 earthquake delivers chilling surprise to California,"California residents experienced another reminder of the state’s seismic activity when a 3.2 magnitude earthquake struck near Santa Barbara Island early Sunday morning. The tremor, detected by the U.S. Geological Survey, shook the coastal region at 1:04 a.m.,…",https://rollingout.com/2025/11/02/3-2-earthquake-surprise-to-california/,https://rollingout.com/wp-content/uploads/2025/08/shutterstock_2291066021-scaled.jpg,,"California residents experienced another reminder of the state’s seismic activity when a 3.2 magnitude earthquake struck near Santa Barbara Island early Sunday morning. The tremor, detected by the U.… [+4775 chars]",
921544ba6ffa0741f2dccd848b03eba4,2025-11-02T20:54:03Z,'earthquake',www.rt.com,en,1.0,"‘Islam allows what is usually forbidden’: How faith, fear, and loss collided in quake-hit Afghanistan","In the forgotten Afghan province of Kunar, a village rebuilds after the earthquake – far from the world’s attention Read Full Article at RT.com",https://www.rt.com/news/627259-kunar-earthquake-aftermath-report/,https://mf.b37mrtl.ru/files/2025.11/article/6907561885f54062191ae164.jpg,,"In the village of Spedar, walnuts fall from the trees, and if you listen closely, you can hear the thud. There’s also the babbling of a stream, the lowing of cows, and the distant crowing of a rooste… [+8231 chars]",
11d33c092db0407bfe48e2fa734585bc,2025-11-02T22:09:41Z,'earthquake',www.aljazeera.com,en,1.0,Powerful magnitude 6.3 quake hits north Afghanistan’s Hindu Kush region,"The earthquake comes two months after the deadliest quake in recent Afghan history, which killed thousands of people.",https://www.aljazeera.com/news/2025/11/2/powerful-magnitude-6-3-quake-hits-north-afghanistans-hindu-kush-region,https://www.aljazeera.com/wp-content/uploads/2025/09/2025-09-02T204923Z_1184233242_RC2HJGA6EPE1_RTRMADP_3_AFGHANISTAN-QUAKE-1756882528.jpg?resize=1920%2C1440,,"A powerful 6.3 magnitude earthquake has struck northern Afghanistan, according to the US Geological Survey (USGS), two months after a tremor killed thousands of people.
The USGS said overnight Sunda… [+826 chars]",
775be555a3b5cd151296882f1824cc53,2025-11-02T22:53:00Z,'earthquake',www.channelnewsasia.com,en,1.0,Powerful 6.3 quake in Northern Afghanistan kills at least seven,"KABUL: A 6.3-magnitude earthquake struck near the northern Afghan city of Mazar-e Sharif early on Monday (Nov 3), killing at least seven people and injuring about 150, provincial authorities said.The US Geological Survey (USGS) said the quake hit at a depth o…",https://www.channelnewsasia.com/asia/earthquake-northern-afghanistan-tremors-usgs-casualties-5441091,"https://dam.mediacorp.sg/image/upload/s--bPCANLJc--/c_crop,h_545,w_968,x_2,y_1/c_fill,g_auto,h_676,w_1200/f_auto,q_auto/v1/mediacorp/cna/image/2025/11/03/image-11.png?itok=6NJWcMmo",,"KABUL: A 6.3-magnitude earthquake struck near the northern Afghan city of Mazar-e Sharif early on Monday (Nov 3), killing at least seven people and injuring about 150, provincial authorities said.
T… [+1977 chars]",
6bd44c0b2b32bd9c48dd5e5cbab8a591,2025-11-02T22:53:00Z,'earthquake magnitude',www.channelnewsasia.com,en,1.0,"Magnitude 6.3 earthquake shakes Afghanistan's Mazar-e Sharif city, casualties feared","A magnitude 6.3 earthquake struck northern Afghanistan overnight Sunday (Nov 2) into Monday, the US Geological Survey (USGS) said, two months after a tremor in the impoverished nation's east killed over 2,200 people.The overnight quake hit at a depth of 28km …",https://www.channelnewsasia.com/asia/earthquake-northern-afghanistan-tremors-usgs-6-magnitude-5441091,"https://dam.mediacorp.sg/image/upload/s--bPCANLJc--/c_crop,h_545,w_968,x_2,y_1/c_fill,g_auto,h_676,w_1200/f_auto,q_auto/v1/mediacorp/cna/image/2025/11/03/image-11.png?itok=6NJWcMmo",,"A magnitude 6.3 earthquake struck northern Afghanistan overnight Sunday (Nov 2) into Monday, the US Geological Survey (USGS) said, two months after a tremor in the impoverished nation's east killed o… [+1976 chars]",
ac3324ab665a8b8475ecd1e2617a3ff5,2025-11-02T23:19:47Z,'earthquake',www.abc.net.au,en,1.0,Magnitude-6.3 earthquake hits Afghanistan,"It is unclear how many people have died following an earthquake in northern Afghanistan, two months after a tremor killed more than 2,200 people.",https://www.abc.net.au/news/2025-11-03/afghanistan-earthquake/105964078,https://live-production.wcms.abc-cdn.net.au/a6d73654076c84cf367ca4b9d217dac4?impolicy=wcms_watermark_news&cropH=341&cropW=607&xPos=17&yPos=135&width=862&height=485&imformat=generic,,"A magnitude-6.3 earthquake has struck northern Afghanistan's Hindu Kush region, according to the US Geological Survey (USGS).
The earthquake hit at a depth of 28 kilometres in Kholm, a town with a p… [+1625 chars]",
d01662f85b70e1e221526b721e75accc,2025-11-03T00:05:44Z,'earthquake',www.bbc.com,en,1.0,Casualties feared after magnitude-6.3 earthquake hits Afghanistan,"The quake struck near Mazar-e Sharif, one of Afghanistan's largest cities in the early hours of Monday.",https://www.bbc.com/news/articles/c8jrw12d3edo,https://ichef.bbci.co.uk/news/1024/branded_news/264c/live/3404eee0-b848-11f0-ba75-093eca1ac29b.png,,"An earthquake has struck near Mazar-e Sharif, one of Afghanistan's largest cities around 20:30 GMT (01:00 local time).
The earthquake had a magnitude of 6.3 and a depth of 28km (17 miles), according… [+667 chars]",
a78006b8055ad298fb5fdd41f9861c57,2025-11-03T00:17:00Z,'earthquake magnitude',www.dw.com,en,1.0,Afghanistan hit by magnitude-6.3 earthquake,"A powerful earthquake has struck northern Afghanistan, near the city of Mazar-i-Sharif. It comes months after thousands of people died in deadly quakes in the country's east.",https://www.dw.com/en/afghanistan-hit-by-magnitude-63-earthquake/a-74592151,https://static.dw.com/image/70746239_6.jpg,,"A powerful mangitude-6.3 earthquake has rocked northern Afghanistan, the US Geological Survey (USGS) said Sunday night.
The earthquake struck early Monday at a depth of 28 kilometers (17 miles) some… [+745 chars]",
2e762363f145176294f72841ddd9953c,2025-11-03T00:17:00Z,'earthquake death',www.dw.com,en,1.0,Afghanistan hit by deadly magnitude 6.3 earthquake,"A strong earthquake has shaken northern Afghanistan near Mazar-i-Sharif, with local authorities reporting several deaths and dozens of injured.",https://www.dw.com/en/afghanistan-hit-by-deadly-magnitude-63-earthquake/a-74592151,https://static.dw.com/image/74592207_6.jpg,,"A powerful magnitude 6.3 earthquake struck northern Afghanistan early on Monday near the city of Mazar-i-Sharif, the capital of Balkh province.
A health department spokesperson for the neighboring S… [+2470 chars]",
be6f6b9bbe219011de8aa51658b99bf2,2025-11-03T01:09:27Z,'earthquake',www.israelnationalnews.com,en,1.0,Northern Afghanistan rocked by 6.3-magnitude earthquake,"6.3-magnitude earthquake strikes near Mazar-i-Sharif, Afghanistan. USGS warns of possible mass casualties.",https://www.israelnationalnews.com/news/417198,https://2.a7.org/files/pictures/000/1055696.jpg,,"A powerful 6.3-magnitude earthquake struck northern Afghanistan early Monday morning (local time), shaking several provinces and prompting fears of widespread destruction. 
The United States Geologi… [+1038 chars]",
1bb115d43b80d621a0bce44aaa6a6c28,2025-11-03T01:58:05Z,'earthquake magnitude',www.cbsnews.com,en,1.0,Afghanistan hit by powerful 6.3 magnitude earthquake,"Local officials have already reported several deaths, warning the toll could climb as search and rescue operations continue.",https://www.cbsnews.com/news/afghanistan-6-3-magnitude-earthquake/,https://assets1.cbsnewsstatic.com/hub/i/r/2025/11/03/ac1cf567-1e28-4628-bf43-da8461948054/thumbnail/1200x630/b13b06e290c633c8ad60d7b202489e75/afghanistan.png,,"A powerful 6.3-magnitude earthquake struck northern Afghanistan early Monday morning local time, according to the USGS and local authorities, sparking fears of mass casualties and the need for a resp… [+1831 chars]",
0787ad1ff251550378fcb16520fb7568,2025-11-03T02:11:00Z,'earthquake',news.sky.com,en,1.0,At least seven dead in Afghanistan earthquake,"The US Geological Survey suggested that ""significant casualties are likely and the disaster is potentially widespread"" after the earthquake in Mazar-e Sharif.",https://news.sky.com/story/at-least-seven-dead-and-150-injured-after-magnitude-6-3-earthquake-in-north-afghanistan-13463004,https://e3.365dm.com/25/11/1600x900/skynews-afghanistan-earthquake_7070249.jpg?20251103035205,,"At least seven people have died after a magnitude 6.3 earthquake in Afghanistan, local officials have said.
The tremor was recorded near the city of Mazar-e Sharif, in the northern Balkh province, a… [+1712 chars]",
14933ff0aa69550c93db0aa458d0a13c,2025-11-03T02:43:35Z,'earthquake magnitude',www.cbc.ca,en,1.0,Deadly 6.3 magnitude earthquake hits northern Afghanistan,"A 6.3-magnitude earthquake struck near the northern Afghan city of Mazar-e Sharif early on Monday, killing at least seven people and injuring about 150, provincial authorities said on Monday.",https://www.cbc.ca/news/world/afghanistan-earthquake-9.6964015,"https://i.cbc.ca/ais/b7163889-5df7-465f-b035-48be57a67389,1762135694206/full/max/0/default.jpg?im=Crop%2Crect%3D%280%2C433%2C4161%2C2340%29%3BResize%3D620",,"A 6.3-magnitude earthquake struck near the northern Afghan city of Mazar-e Sharif early on Monday, killing at least seven people and injuring about 150, provincial authorities said on Monday.
The U.… [+1959 chars]",
260b8d5d681842b57495db4c1fa255c2,2025-11-03T03:08:10Z,'earthquake',indianexpress.com,en,1.0,"Afghanistan Earthquake Live Updates: 7 killed, 150 injured after 6.3 magnitude earthquake hits Mazar-e Sharif, more casualties feared","Afghanistan Earthquake News Today Live Updates: According to the US Geological Survey, the depth of the earthquake was 28 km (17.4 miles) near Mazar-e Sharif. The USGS also warned of ""significant casualties"" and ""potentially widespread"" disaster.",https://indianexpress.com/article/world/afghanistan-earthquake-live-updates-several-killed-mazar-e-sharif-10342702/,https://images.indianexpress.com/2025/11/afghan-earthquake.jpg,,"Afghanistan Earthquake Live Updates: Collapsed houses are seen in an area devastated by earthquake that killed many people and destroyed villages in eastern Afghanistan, in Dara Noor, Kunar province.… [+2646 chars]",
361e2906804bedc16c8b033d5fd02e69,2025-11-03T03:16:43Z,'earthquake magnitude',economictimes.indiatimes.com,en,1.0,Why is Afghanistan so prone to earthquakes?,"Afghanistan faces frequent earthquakes. A recent 6.3 magnitude quake killed seven people. The country sits on active tectonic plate boundaries, making it prone to tremors. Eastern and northeastern regions are most at risk. Past quakes have caused significant …",https://economictimes.indiatimes.com/news/international/world-news/why-is-afghanistan-so-prone-to-earthquakes/articleshow/125045866.cms,"https://img.etimg.com/thumb/msid-125045887,width-1200,height-630,imgsize-807488,overlay-economictimes/articleshow.jpg",,"A 6.3-magnitude earthquake struck near the northern Afghan city of Mazar-e Sharif early on Monday, killing at least seven people and injuring about 150, just months after a quake and strong aftershoc… [+2569 chars]",
69f30569b6b6a3d7e3013f6aa66ecfb4,2025-11-03T04:31:23Z,'earthquake',www.rte.ie,en,1.0,At least 9 dead in Afghanistan earthquake,"A strong earthquake killed at least nine people in northern Afghanistan, authorities said, just months after another deadly tremor left the country reeling.",https://www.rte.ie/news/world/2025/1103/1541816-at-least-9-dead-in-afghanistan-earthquake/,https://www.rte.ie/images/00236a37-1600.jpg,,"A strong earthquake killed at least nine people in northern Afghanistan, authorities said, just months after another deadly tremor left the country reeling.
The 6.3-magnitude quake struck overnight … [+2179 chars]",
356826c9875d98e1408a6f43e092bb4e,2025-11-03T04:31:23Z,'earthquake',www.rte.ie,en,1.0,"Afghanistan earthquake kills 20, injures over 300","A strong earthquake has killed at least 20 people in northern Afghanistan, authorities have said, just months after another deadly tremor that left the country reeling.",https://www.rte.ie/news/world/2025/1103/1541816-afghanistan-earthquake/,https://www.rte.ie/images/00236a38-1600.jpg,,"A strong earthquake has killed at least 20 people in northern Afghanistan, authorities have said, just months after another deadly tremor that left the country reeling.
The 6.3-magnitude quake struc… [+2571 chars]",
9d0e286c29efcdc8105c4135342c2fa9,2025-11-03T05:30:21Z,'earthquake',www.cincinnati.com,en,0.0,"In Cincinnati, JD Vance's half brother hopes for a political 'earthquake' in mayor race","Despite, or maybe because of, Cory Bowman's personal relationship to the White House, he faces a steep climb against incumbent Aftab Pureval.",https://www.cincinnati.com/story/news/politics/2025/11/03/bowman-vs-pureval-can-vances-half-brother-unseat-incumbent-mayor/86834312007/,https://s.yimg.com/ny/api/res/1.2/ADWrOygg5bkuy9J3am3A3A--/YXBwaWQ9aGlnaGxhbmRlcjt3PTEyMDA7aD03MDk7Y2Y9d2VicA--/https://media.zenfs.com/en/the_enquirer_natl_articles_358/a591096c892b619ff40ce465ffa26052,,"It's not been a typical mayoral race in Cincinnati.
First off, Republicans don't often run for mayor of Cincinnati, a city that has voted  3-to-1 Democratic in recent presidential elections. The las… [+10975 chars]",
f60b849c87ced3566e910da26e1e1922,2025-11-03T05:42:26Z,'earthquake death',www.israelnationalnews.com,en,0.0,Earthquake in Northern Afghanistan: Death toll rises to 20,"Local authorities in northern Afghanistan report that the death toll in the earthquake in the city of Mazar-i Sharif has risen to 20.In addition, 320 people were injured.",https://www.israelnationalnews.com/flashes/669704,https://2.a7.org/files/pictures/000/1075218.jpg,,"Local authorities in northern Afghanistan report that the death toll in the earthquake in the city of Mazar-i Sharif has risen to 20.
In addition, 320 people were injured.",
b7c6a44ab08646ccf0d3bd39390c7d93,2025-11-03T06:43:42Z,'earthquake damage',www.aljazeera.com,en,1.0,Video: Afghanistan’s Blue Mosque damaged in earthquake,"Video shows earthquake damage to Afghanistan’s shrine of Mazar-i-Sharif, also known as The Blue Mosque.",https://www.aljazeera.com/video/newsfeed/2025/11/3/afghanistans-blue-mosque-damaged-in-earthquake,https://www.aljazeera.com/wp-content/uploads/2025/11/image-1762152213.jpg?resize=1920%2C1080&quality=80,,"NewsFeed
Video shows damage to Afghanistans shrine of Mazar-i-Sharif, also known as The Blue Mosque, after a 6.3 magnitude earthquake. Officials in the area say at least seven people have been kille… [+17 chars]",
216083a016c56b2ec5a4c01f49301cc4,2025-11-03T06:51:18Z,'earthquake magnitude',www.thejournal.ie,en,1.0,"Afghanistan earthquake kills 20, injures over 300",The 6.3-magnitude quake struck overnight – less than three months after another deadly quake hit the country in August.,https://www.thejournal.ie/earthquake-afghanistan-kills-20-6862886-Nov2025/,https://img2.thejournal.ie/article/6862886/river/?height=400&version=6862893,http://web.archive.org/web/20251104052333/https://www.thejournal.ie/earthquake-afghanistan-kills-20-6862886-Nov2025/,"A STRONG EARTHQUAKE killed at least 20 people in northern Afghanistan, authorities have said, just months after another deadly tremor that left the country reeling.
The 6.3-magnitude quake struck ov… [+2497 chars]",
6c6012cbb07366b7b689c4e6cebd647a,2025-11-03T06:58:19Z,'earthquake death',www.independent.ie,en,1.0,"Powerful 6.3 earthquake kills at least 20 in Afghanistan, injures 320","A 6.3-magnitude earthquake struck near the northern Afghan city of Mazar-e Sharif early on Monday, killing at least 20 people and injuring about 320, authorities said, with the death toll likely to rise.",https://www.independent.ie/world-news/middle-east/powerful-63-earthquake-kills-at-least-20-in-afghanistan-injures-320/a1337997902.html,https://focus.independent.ie/thumbor/orW5VRtha9-MDEEqAdorMsjoawQ=/629x460/smart/prod-mh-ireland/892f80a7-5c58-4dcf-8808-b6b2984ea833/b7fe37e7-82b8-408a-ae18-5d4758a4dc3e/892f80a7-5c58-4dcf-8808-b6b2984ea833.jpg,,"6.3-magnitude quake strikes near Mazar-e Sharif in northern AfghanistanAt least 20 killed and about 320 injured, officials sayPart of Mazars historic Blue Mosque damagedUSGS issues orange alert, warn… [+2572 chars]",
2a8358192b8bb592748a4a2c19bb5d17,2025-11-03T07:04:25Z,'earthquake magnitude',www.nbcnews.com,en,1.0,Powerful earthquake kills at least 20 people in northern Afghanistan,"At least 20 people have been killed and hundreds more injured in Afghanistan after a 6.3-magnitude earthquake struck the northern part of the country early Monday, the ruling Taliban said.",https://www.nbcnews.com/world/asia/powerful-earthquake-kills-least-20-people-northern-afghanistan-rcna241524,"https://media-cldnry.s-nbcnews.com/image/upload/t_nbcnews-fp-1200-630,f_auto,q_auto:best/rockcms/2025-11/20251103-afghanistan-earthquake-jj-1222a-4024f0.jpg",,"PESHAWAR, Pakistan At least 20 people have been killed and hundreds more injured in Afghanistan after a 6.3-magnitude earthquake struck the northern part of the country early Monday, the ruling Talib… [+2319 chars]",
cfc824739a2ebae5ed3693b939602d70,2025-11-03T07:06:29Z,'earthquake',www.yahoo.com,en,0.0,"Afghanistan quake kills 20, injures over 300: health ministry","A strong earthquake killed at least 20 people in northern Afghanistan, authorities said Monday, just months after another deadly tremor that left the country...",https://www.yahoo.com/news/articles/afghanistan-quake-kills-20-injures-070629048.html,https://media.zenfs.com/en/afp.com/44424d95588f000ff389eb57165bccb3,,"A strong earthquake killed at least 20 people in northern Afghanistan, authorities said Monday, just months after another deadly tremor that left the country reeling.
The 6.3-magnitude quake struck … [+2513 chars]",
21539bb9c9c5b44773317bacf4885e58,2025-11-03T07:07:20Z,'quake injures',www.digitaljournal.com,en,1.0,"Afghanistan quake kills 20, injures over 300: health ministry","A strong earthquake killed at least 20 people in northern Afghanistan, authorities said Monday, just months after another deadly tremor that left the country reeling. The 6.3-magnitude quake struck overnight at a depth of 28 kilometers (17 miles) with the epi…",https://www.digitaljournal.com/world/afghanistan-quake-kills-20-injures-over-300-health-ministry/article,https://www.digitaljournal.com/wp-content/uploads/2025/11/6a9f150cc9de5293e37f8f07c5acf82e024aeac1.jpg,,"An Afghan woman sits beside an earthquake victim receiving treatment at a hospital in Mazar-i-Sharif on November 3, 2025, after a 6.3-magnitude quake struck overnight, killing at least 20 people -- j… [+2775 chars]",
ee201b8357269b66897c9be005579eb7,2025-11-03T09:44:40Z,'earthquake disaster',rollingout.com,en,1.0,Afghanistannulls 6.3 earthquake strikes vulnerable nation,"A powerful earthquake jolted northern Afghanistan early Monday morning, claiming at least 20 lives and leaving hundreds injured in a disaster that struck the country’s already fragile infrastructure. The 6.3-magnitude tremor, centered near the historic city o…",https://rollingout.com/2025/11/03/afghanistans-6-3-earthquake-strikes/,https://rollingout.com/wp-content/uploads/2025/11/image-1000x667-2025-11-03T173254.510.png,,"A powerful earthquake jolted northern Afghanistan early Monday morning, claiming at least 20 lives and leaving hundreds injured in a disaster that struck the country’s already fragile infrastructure.… [+4857 chars]",
a9020bbdf74164e33612169768ec84d2,2025-11-03T11:13:50Z,'earthquake magnitude',people.com,en,1.0,At Least 20 Dead and Over 300 Injured After 6.3-Magnitude Earthquake with Casualty Figures 'Likely to Rise',"The earthquake took place in the provinces of Samangan and Balkh in Afghanistan on Monday, Nov. 3",https://people.com/20-dead-300-injured-magnitude-6-3-earthquake-11841869,https://s.yimg.com/ny/api/res/1.2/.v74I_G2fXr8zGx.IAsBtw--/YXBwaWQ9aGlnaGxhbmRlcjt3PTEyMDA7aD04MDA7Y2Y9d2VicA--/https://media.zenfs.com/en/people_218/48ea4d7e22f8cb1db3032ef0d44dc9a2,,"NEED TO KNOW
<ul><li>At least 20 people have died and 320 have been injured after a magnitude 6.3 earthquake hit Afghanistan
</li><li>The disaster took place at 1:00 a.m. on Monday, Nov. 3, near th… [+3471 chars]",
fb5dc71ee50de0b5309661fdfd455829,2025-11-03T11:39:13Z,'earthquake',www.independent.ie,en,1.0,Powerful earthquake kills at least 20 people and injures hundreds in northern Afghanistan,"A powerful, 6.3 magnitude earthquake shook northern Afghanistan before dawn Monday, killing at least 20 people and injuring more than 500 others, a health official said, adding that the numbers could increase.",https://www.independent.ie/world-news/middle-east/powerful-earthquake-kills-at-least-20-people-and-injures-hundreds-in-northern-afghanistan/a1337997902.html,https://focus.independent.ie/thumbor/w2luPixBNYeoJW2xE1B8mGLrBxQ=/275x0:3249x1983/629x0/prod-mh-ireland/f69c89d9-379f-4d4c-813d-35d55f32c903/0bb25ae2-8321-44f8-9b77-d14242cd9361/f69c89d9-379f-4d4c-813d-35d55f32c903.jpg,,"6.3-magnitude quake strikes near Mazar-e Sharif in northern AfghanistanAt least 20 killed and about 320 injured, officials sayPart of Mazars historic Blue Mosque damagedUSGS issues orange alert, warn… [+3408 chars]",
b504c7e8e1f3a7d9f08d32076037b4c5,2025-11-03T13:12:26Z,'earthquake disaster',www.hurriyetdailynews.com,en,1.0,4.9 magnitude earthquake strikes western Türkiye,"A 4.9 magnitude earthquake hit the Sındırgı district of Türkiye's western Balikesir province on Monday, felt across Istanbul, Izmir, Bursa, and surrounding areas, according to the Disaster and Emergency Management Authority (AFAD).",https://www.hurriyetdailynews.com/4-9-magnitude-earthquake-strikes-western-turkiye-215337,https://image.hurimg.com/i/hurriyet/75/200x200/6908aa37d30ab035b52603e6.jpg,,"BALIKESR
A 4.9 magnitude earthquake hit the Sndrg district of Türkiye's western Balikesir province on Monday, felt across Istanbul, Izmir, Bursa, and surrounding areas, according to the Disaster and… [+1711 chars]",
19a7d67d78b7f7ebaafdc2ff15844d72,2025-11-03T13:38:38Z,'earthquake',www.aljazeera.com,en,1.0,Deadly earthquake hits northern Afghanistan,"Powerful earthquake of magnitude 6.3 shakes northern Afghanistan, killing at least 20 people and injuring more than 500.",https://www.aljazeera.com/gallery/2025/11/3/deadly-earthquake-hits-northern-afghanistan,https://www.aljazeera.com/wp-content/uploads/2025/11/AFP__20251103__82U37WE__v1__HighRes__AfghanistanEarthquake-1762162466.jpg?resize=1920%2C1440,,"A magnitude 6.3 earthquake has shaken northern Afghanistan, killing at least 20 people and injuring more than 500, a health official says, adding that the numbers could increase.
The quakes epicentr… [+1424 chars]",
84d671d1fba49cf65aa4fc6a41264dc1,2025-11-03T14:33:29Z,'earthquake',slashdot.org,en,1.0,"Earthquake in Afghanistan kills 20 and injures hundreds, health ministry says - The Washington Post","Earthquake in Afghanistan kills 20 and injures hundreds, health ministry saysThe Washington Post At least 20 dead after magnitude-6.3 earthquake hits AfghanistanBBC Powerful 6.3 earthquake hits northern Afghanistan, killing 20 and injuring at least 640Click2H…",https://slashdot.org/firehose.pl?op=view&amp;id=179951058,,http://web.archive.org/web/20160119174443/http://slashdot.org/firehose.pl?op=view,The Fine Print: The following comments are owned by whoever posted them. We are not responsible for them in any way.,
500e9f989c72c71e4ce765add1559ced,2025-11-03T17:58:00Z,'earthquake',www.dw.com,en,1.0,Afghanistan's historic Blue Mosque damaged by earthquake,"The Blue Mosque of Mazar-e-Sharif which dates back to the 15th century was affected by the earthquake. At least 20 people were killed and more than 600 were injured, according to authorities.",https://www.dw.com/en/afghanistans-historic-blue-mosque-damaged-by-earthquake/a-74603321,https://static.dw.com/image/74602897_6.jpg,http://web.archive.org/web/20251104073538/https://www.dw.com/en/afghanistans-historic-blue-mosque-damaged-by-earthquake/a-74603321,"The historic Blue Mosque of Mazar-e-Sharif was damaged in the earthquake in northern Afghanistan, officials confirmed on Monday. 
In a video from Afghan online news outlet TOLOnews showed debris on … [+2328 chars]",
5863c4959e54f15c7af230bf595e657a,2025-11-03T20:49:30Z,'earthquake victims',press.un.org,en,0.1,Daily Press Briefing by the Office of the Spokesperson for the Secretary-General,"The Central Emergency Response Fund has released $4 million to scale up the response to Hurricane Melissa in the Caribbean, providing food, health, water, shelter, logistics and sanitation and hygiene support. More members of a UN Disaster Assessment and Coor…",https://press.un.org/en/2025/db251103.doc.htm,,,"The following is a near-verbatim transcript of todays briefing by Farhan Haq, Deputy Spokesman for the Secretary-General.
**Briefings Today and Tomorrow
Good afternoon, everyone.
As a reminder, at… [+29111 chars]",
