index,published,keyword,domain,language,valid,title,description,url,image,archive,content,quote,de,en,la,added
4106ce248b459c07f4a09019e8c5bcd2,2026-02-19T16:28:33Z,'tsunami',www.haaretz.com,en,0.9,"Turkish superstar to 'Zionist traitor': Iconic singer Linet is caught between Gaza, death threats and diehard fans","Caught between two homelands, Israel and Turkey, Linet has long navigated the fragile intersection of identity, music, and politics. After condemning Hamas and saying Israel committed genocide in Gaza, she now faces a tsunami of both antisemitic abuse and acc…",https://www.haaretz.com/life/2026-02-19/ty-article-magazine/.premium/superstar-to-zionist-traitor-singer-linet-caught-between-gaza-death-threats-and-fans/0000019c-71a2-d759-a7bf-ffba96640000,"https://img.haarets.co.il/bs/0000019c-71a2-d759-a7bf-ffba96640000/ca/ec/10632c1d4b1baf2fe7d1f768400d/870699.jpg?precrop=2372,1379,x0,y0&width=1200&height=630&cmsprod",,"Just two weeks ago, Turkish-Israeli singer Linet Menashe released a new video to accompany her Turkish megahit ""Meerse"" (""It Turns Out""). The original video garnered over 13 million YouTube views sin… [+294 chars]",,"Türkischer Superstar zum „zionistischen Verräter“: Die legendäre Sängerin Linet steckt zwischen Gaza, Morddrohungen und eingefleischten Fans. Gefangen zwischen zwei Heimatländern, Israel und der Türkei, navigiert Linet seit langem an der fragilen Schnittstelle von Identität, Musik und Politik. Nachdem sie die Hamas verurteilt und gesagt hat, Israel habe in Gaza einen Völkermord begangen, sieht sie sich nun einem Tsunami antisemitischer Beschimpfungen und Anfeindungen gegenüber.","Turkish superstar to 'Zionist traitor': Iconic singer Linet is caught between Gaza, death threats and diehard fans. Caught between two homelands, Israel and Turkey, Linet has long navigated the fragile intersection of identity, music, and politics. After condemning Hamas and saying Israel committed genocide in Gaza, she now faces a tsunami of both antisemitic abuse and acc…","Turcicus superstar ad 'Sionistam proditorem': Iconicus cantor Linet inter Gazam captus est, mortis minas et diehard fans. Inter duas patrias, Israelem et Turciam, Linet intersectio fragilis identitatis, musicae et politicae diu navigavit. Postquam Hamas damnavit et Israel in Gaza genocidem commisit dicens, nunc tsunami utriusque abusus antisemiticus et acc…",2026-02-27 19:59:19+00:00
a0a7651dbfcc4e2104811b88dc41721f,2026-02-21T01:09:07Z,'tsunami',timesofindia.indiatimes.com,en,0.9,Impact of AI on labour market will be like 'tsunami': IMF chief,"India Business News: New Delhi: The impact of AI on the labour market will be like a \""tsunami\"" and can create havoc in financial markets, International Monetary Fund chief.",https://timesofindia.indiatimes.com/business/india-business/impact-of-ai-on-labour-market-will-be-like-tsunami-imf-chief/articleshow/128629696.cms,"https://static.toiimg.com/thumb/msid-128629710,width-1280,height-720,imgsize-237346,resizemode-6,overlay-toi_sw,pt-32,y_pad-600/photo.jpg",http://web.archive.org/web/20260222060542/https://timesofindia.indiatimes.com/business/india-business/impact-of-ai-on-labour-market-will-be-like-tsunami-imf-chief/articleshow/128629696.cms,EMI CalculatorDetermine the monthly installment amount for a loan,,"Die Auswirkungen von KI auf den Arbeitsmarkt werden wie ein „Tsunami“ sein: IWF-Chef. India Business News: Neu-Delhi: Die Auswirkungen von KI auf den Arbeitsmarkt werden wie ein „Tsunami“ sein und Chaos auf den Finanzmärkten anrichten, so der Chef des Internationalen Währungsfonds.","Impact of AI on labour market will be like 'tsunami': IMF chief. India Business News: New Delhi: The impact of AI on the labour market will be like a \""tsunami\"" and can create havoc in financial markets, International Monetary Fund chief.","Impetus AI in mercatu laboris erit sicut 'tsunami': IMF capitalis. India Negotia Nuntii: Nova Delhi: Ictus AI in mercatu laboris sicut \""tsunami\ erit et stragem in mercatibus nummariis creare potest, Fundi Internationalis Monetariae dux.",2026-02-27 19:59:19+00:00
1d3703ed6d5268640bd440741228025b,2026-02-22T06:00:00Z,'tsunami',www.naturalnews.com,en,0.9,Three Revolutionary Technologies That Will Make You Think You’re Living in the Future,Introduction: A Future of Decentralization and Deflation The future isn’t arriving incrementally; it’s crashing into the present with a series of technological tsunamis. Forget the slow drip of incremental upgrades; we are on the verge of breakthroughs that w…,https://www.naturalnews.com/2026-02-22-three-revolutionary-technologies-youre-living-in-the-future.html,https://www.naturalnews.com/wp-content/uploads/sites/91/2026/02/solid-state-battery-energy-grid-decentralization-ai-cost-reduction-313-original.jpg,http://web.archive.org/web/20260222143702/https://www.naturalnews.com/2026-02-22-three-revolutionary-technologies-youre-living-in-the-future.html,"Introduction: A Future of Decentralization and Deflation
The future isn't arriving incrementally; it's crashing into the present with a series of technological tsunamis. Forget the slow drip of incr… [+7531 chars]",,"Drei revolutionäre Technologien, die Sie glauben lassen, dass Sie in der Zukunft leben. Einleitung: Eine Zukunft der Dezentralisierung und Deflation Die Zukunft kommt nicht schrittweise; Es stürzt mit einer Reihe technologischer Tsunamis in die Gegenwart. Vergessen Sie den langsamen Tropfen inkrementeller Upgrades; Wir stehen kurz vor Durchbrüchen, die …",Three Revolutionary Technologies That Will Make You Think You’re Living in the Future. Introduction: A Future of Decentralization and Deflation The future isn’t arriving incrementally; it’s crashing into the present with a series of technological tsunamis. Forget the slow drip of incremental upgrades; we are on the verge of breakthroughs that w…,Tres Technologiae Revolutionariae Quod Facies You're You're Living in Future. Introductio: Future Decentralizationis et Deflation: Futura incrementally non venit; in praesens cum tsunamis technologicis incidit. Oblivisa tardis destillationibus incrementorum incrementorum; paene breakthroughs ut w ...,2026-02-27 19:59:19+00:00
6e4d3a7bbab4a58b208fa63c3390da7a,2026-02-23T06:00:00Z,'tsunami',thequietus.com,en,0.9,Ben Vince – Street Druid,"Ben Vince
Street Druid
Premium sax honker Ben Vince is bringing sexy back in 2026 (sort of), says Bernie Brooks
Street Druid by Ben Vince
It’s hard to feel sexy these days.
2025 was screeching tinnitus all the time, was a tsunami-warning klaxon every five min…",https://thequietus.com/quietus-reviews/ben-vince-street-druid-review/,https://thequietus.com/app/uploads/2026/02/ben-vince-street-druid.jpg,http://web.archive.org/web/20260223085131/https://thequietus.com/quietus-reviews/ben-vince-street-druid-review/,"Its hard to feel sexy these days.
2025 was screeching tinnitus all the time, was a tsunami-warning klaxon every five minutes. 2026 is workmen sawing through the pavement just outside your window at … [+3150 chars]",,"Ben Vince – Straßendruide. Ben Vince
Straßendruide
Der Premium-Saxophonist Ben Vince bringt im Jahr 2026 (sozusagen) Sexy zurück, sagt Bernie Brooks
Straßendruide von Ben Vince
Heutzutage ist es schwer, sich sexy zu fühlen.
Im Jahr 2025 gab es ständig kreischenden Tinnitus, alle fünf Minuten ertönte ein Tsunami-Warnton …","Ben Vince – Street Druid. Ben Vince
Street Druid
Premium sax honker Ben Vince is bringing sexy back in 2026 (sort of), says Bernie Brooks
Street Druid by Ben Vince
It’s hard to feel sexy these days.
2025 was screeching tinnitus all the time, was a tsunami-warning klaxon every five min…","Ben Vince - Street Druid. Beniaminus Vince
Street Druid
Premium sax honker Ben Vince in 2026 sexy reducit (speciem), dicit Bernie Brooks
Street Druid by Ben Vince
Lorem his diebus sentire difficile est.
2025 tinnitus stridens omni tempore erat tsunami-monitio klaxon quinque min…",2026-02-28 03:32:25+00:00
39f6b314a3718e58ceaf0d71e058f617,2026-02-24T21:46:26Z,'tsunami',japantoday.com,en,0.9,Lawson opens 1st disaster-support convenience store ahead of quake anniversary,"Convenience store operator Lawson Inc on Tuesday opened its first store designed to serve as a disaster support hub for communities at times of emergencies, ahead of the March anniversary of the massive quake and tsunami calamity that ravaged northeastern Jap…",https://japantoday.com/category/business/lawson-opens-1st-disaster-support-convenience-store-ahead-of-quake-anniv.,,,"Convenience store operator Lawson Inc on Tuesday opened its first store designed to serve as a disaster support hub for communities at times of emergencies, ahead of the March anniversary of the mass… [+2541 chars]",,"Lawson eröffnet vor dem Erdbeben-Jubiläum den ersten Lebensmittelladen für Katastrophenhilfe. Der Convenience-Store-Betreiber Lawson Inc. hat am Dienstag vor dem März-Jahrestag des gewaltigen Erdbebens und der Tsunami-Katastrophe, die den Nordosten Japans verwüstet hat, sein erstes Geschäft eröffnet, das als Anlaufstelle für Katastrophenhilfe in Notsituationen für Gemeinden dienen soll.","Lawson opens 1st disaster-support convenience store ahead of quake anniversary. Convenience store operator Lawson Inc on Tuesday opened its first store designed to serve as a disaster support hub for communities at times of emergencies, ahead of the March anniversary of the massive quake and tsunami calamity that ravaged northeastern Jap…","Lawson aperit 1 calamitatem-auxilium commodum horreorum ante anniversarium motae. Commodum copia operator Lawson Inc die Martis aperuit primam suam copiam dispositum est ut calamitatem subsidii centrum pro communitatibus in temporibus repentinis servet, ante Martium anniversarium ingentis motus et calamitatis tsunami quae septentrionales Jap ... depopulatus est.",2026-03-01 04:09:16+00:00
77304fc51ab69b3061db3b1904daf570,2026-02-11T18:04:58Z,'tsunami warning system',www.computerworld.com,en,0.3,JumpCloud: Most businesses aren't truly ready for AI,JumpCloud: Most businesses aren't truly ready for AIcomputerworld.com,https://www.computerworld.com/article/4130812/jumpcloud-most-businesses-arent-truly-ready-for-ai.html,https://www.computerworld.com/wp-content/uploads/2026/02/4130812-0-94223300-1770831781-shutterstock_2537582165.jpg?quality=50&strip=all&w=1024,http://web.archive.org/web/20260212000203/https://www.computerworld.com/article/4130812/jumpcloud-most-businesses-arent-truly-ready-for-ai.html,"In the background, the leader of Anthropic’s Safeguards Research Team, Mrinank Sharma, just quit, warning the “world is in peril” from a series of interconnected crises, including AI. Think about tha… [+750 chars]",,JumpCloud: Die meisten Unternehmen sind nicht wirklich bereit für KI. JumpCloud: Die meisten Unternehmen sind nicht wirklich bereit für AIcomputerworld.com,JumpCloud: Most businesses aren't truly ready for AI. JumpCloud: Most businesses aren't truly ready for AIcomputerworld.com,JumpCloud: Pleraque negotia non vere parata AI. JumpCloud: Pleraque res non vere parata AIcomputerworld.com,2026-03-01 19:51:54+00:00
080578faf8ad00cb7c6f056db8197a72,2026-02-16T16:30:54Z,'tsunami warning',www.santafenewmexican.com,en,0.3,'An alarm bell': Los Alamos Visiting Nurse Service shutters amid turmoil for home health care,"The closure should serve as a warning for the industry and policymakers, said the leader of a home and hospice care association.",https://www.santafenewmexican.com/news/local_news/an-alarm-bell-los-alamos-visiting-nurse-service-shutters-amid-turmoil-for-home-health-care/article_0e1e1648-7bfb-465a-b1d6-5c01d68d7c25.html,https://bloximages.newyork1.vip.townnews.com/santafenewmexican.com/content/tncms/assets/v3/editorial/e/06/e06b55d3-6dda-43ff-a335-428cdb60726c/698d48b942337.image.jpg?crop=1662%2C873%2C0%2C187&resize=1200%2C630&order=crop%2Cresize,http://web.archive.org/web/20260217134125/https://www.santafenewmexican.com/news/local_news/an-alarm-bell-los-alamos-visiting-nurse-service-shutters-amid-turmoil-for-home-health-care/article_0e1e1648-7bfb-465a-b1d6-5c01d68d7c25.html,"A home health and hospice agency that has been serving Los Alamos and Rio Arriba counties for more than 50 years will shutter later this month, a closure agency officials attributed to decreasing rev… [+10356 chars]",,"„Eine Alarmglocke“: Der Visiting Nurse Service von Los Alamos schließt inmitten der Turbulenzen um die häusliche Krankenpflege. Die Schließung sollte als Warnung für die Branche und die politischen Entscheidungsträger dienen, sagte der Leiter eines Verbands für Heim- und Hospizpflege.","'An alarm bell': Los Alamos Visiting Nurse Service shutters amid turmoil for home health care. The closure should serve as a warning for the industry and policymakers, said the leader of a home and hospice care association.","""Tabula clangor"": Los Alamos Visitans Nutrix Muneris adaperta inter tumultus ad domum sanitatis. Claustrum monitum esse debet propter industriam et consilium, dixit princeps domus et hospitalis curam consociationis.",2026-03-01 19:51:54+00:00
fe62ec6347d4cd0ad1ec928c914573b2,2026-02-24T05:00:00Z,'tsunami',www.hrw.org,en,0.7,"Iran: Tsunami of Arbitrary Arrests, Enforced Disappearances","Click to expand Image
 



 
 
 

 
 
 
 
 © 2026 John Holmes for Human Rights Watch
 
 


 
Iran’s intelligence agencies and security forces have carried out mass, arbitrary, violent arrests and detentions of protesters, including children, since December 28…",https://www.hrw.org/news/2026/02/24/iran-tsunami-of-arbitrary-arrests-enforced-disappearances,https://www.hrw.org/sites/default/files/styles/opengraph/public/media_2026/02/202602mena_iran_detentions_collage.jpg?h=a7444f0f&itok=nxtDHzWY,,"<ul><li>Irans intelligence agencies and security forces have carried out mass, arbitrary, violent arrests and detentions of protesters, including children, since December 28, 2025. Tens of thousands … [+32788 chars]",,"Iran: Tsunami willkürlicher Verhaftungen und Verschwindenlassen. Klicken Sie, um das Bild zu vergrößern
 



 
 
 

 
 
 
 
 © 2026 John Holmes für Human Rights Watch
 
 


 
Irans Geheimdienste und Sicherheitskräfte haben seit dem 28. Dezember willkürliche und gewaltsame Massenverhaftungen und Inhaftierungen von Demonstranten, darunter auch Kindern, durchgeführt.","Iran: Tsunami of Arbitrary Arrests, Enforced Disappearances. Click to expand Image
 



 
 
 

 
 
 
 
 © 2026 John Holmes for Human Rights Watch
 
 


 
Iran’s intelligence agencies and security forces have carried out mass, arbitrary, violent arrests and detentions of protesters, including children, since December 28…","Iran: Tsunami Arrests Arrests, Disappearances. Click to expand Image
 



 
 
 

 
 
 
 
 © 2026 John Holmes for Human Rights Watch
 
 


 
Iran's intelligentiae institutionum et copiae securitatis massam, arbitrariam, violentam, comprehensiones et detentiones protestantium, inclusorum infantium, post diem 28 Decembris.",2026-03-02 03:58:42+00:00
fbdd0aaa1e4cf59ad67bead9addec67f,2026-02-23T05:02:26Z,'tsunami',economictimes.indiatimes.com,en,0.9,Teaser for Nikhil Kamath's podcast has Anthropic CEO Dario Amodei warning of AI tsunami,"In a conversation with Kamath on the ""People by WTF"" podcast, the Anthropic CEO said AI has enormous economic and geopolitical stakes and warned that too many people are in denial about the scale of disruption ahead.",https://economictimes.indiatimes.com/tech/technology/teaser-for-nikhil-kamaths-podcast-has-anthropic-ceo-dario-amodei-warning-of-ai-tsunami/articleshow/128699730.cms,"https://img.etimg.com/thumb/width-1200,height-900,imgsize-1059823,resizemode-75,msid-128699730/tech/technology/teaser-for-nikhil-kamaths-podcast-has-anthropic-ceo-dario-amodei-warning-of-ai-tsunami.jpg",,"A teaser for Zerodha cofounder Nikhil Kamath's latest podcast features Anthropic CEO Dario Amodei comparing the impending wave of artificial intelligence (AI) to ""a tsunami"". Amodei said that the tec… [+2420 chars]",,"Im Teaser zum Podcast von Nikhil Kamath warnt Anthropic-CEO Dario Amodei vor einem KI-Tsunami. In einem Gespräch mit Kamath im Podcast „People by WTF“ sagte der Anthropic-CEO, dass KI enorme wirtschaftliche und geopolitische Risiken habe und warnte, dass zu viele Menschen das Ausmaß der bevorstehenden Störungen leugnen.","Teaser for Nikhil Kamath's podcast has Anthropic CEO Dario Amodei warning of AI tsunami. In a conversation with Kamath on the ""People by WTF"" podcast, the Anthropic CEO said AI has enormous economic and geopolitical stakes and warned that too many people are in denial about the scale of disruption ahead.","Teaser pro Nikhil Kamath podcast anthropicum CEO Dario Amodei monitum AI tsunami habet. In colloquio cum Kamath de ""Populus WTF"" podcast, anthropicus CEO AI dixit palos oeconomicos et geopoliticos enormes habet et monuit nimium multos homines negasse circa scalam distractionis antecedere.",2026-03-02 03:58:42+00:00
6691d5ab9e0eb54ba404b648b98f20f0,2026-02-25T09:55:08Z,'tsunami warning',economictimes.indiatimes.com,en,0.9,'AI Tsunami' warning: Anthropic CEO Dario Amodei identifies the one job category that will survive automation era,"Anthropic CEO Dario Amodei has warned that an “AI tsunami” is fast approaching, saying artificial intelligence could eventually become superior to humans “at everything.” Speaking to Zerodha co-founder Nikhil Kamath, he said society is not fully prepared for …",https://economictimes.indiatimes.com/magazines/panache/ai-tsunami-warning-anthropic-ceo-dario-amodei-identifies-the-one-job-category-that-will-survive-automation-era/articleshow/128776473.cms,"https://img.etimg.com/thumb/msid-128777475,width-1200,height-630,imgsize-32344,overlay-etpanache/articleshow.jpg",,The conversation around artificial intelligence is no longer about whether it will change things. It is about how fast it will happen and who is ready. The head of AI company Anthropic has issued a s… [+3439 chars],,"„KI-Tsunami“-Warnung: Anthropic-CEO Dario Amodei identifiziert die einzige Berufskategorie, die das Zeitalter der Automatisierung überleben wird. Dario Amodei, CEO von Anthropic, warnte davor, dass ein „KI-Tsunami“ schnell bevorstehe, und sagte, dass künstliche Intelligenz dem Menschen irgendwann „in allem“ überlegen sein könnte. Im Gespräch mit Zerodha-Mitbegründer Nikhil Kamath sagte er, die Gesellschaft sei nicht vollständig darauf vorbereitet …","'AI Tsunami' warning: Anthropic CEO Dario Amodei identifies the one job category that will survive automation era. Anthropic CEO Dario Amodei has warned that an “AI tsunami” is fast approaching, saying artificial intelligence could eventually become superior to humans “at everything.” Speaking to Zerodha co-founder Nikhil Kamath, he said society is not fully prepared for …","'AI Tsunami' monitum: Anthropica CEO Dario Amodei agnoscit unum officium categoriae quae superstes erit aetatis automationis. Anthropica CEO Dario Amodei admonuit ""AI tsunami"" celeriter appropinquare, dicens intellegentiam artificialem posse tandem fieri hominibus ""omnino"". Zerodha co-conditor Nikhil Kamath loquens dixit societatem non esse plene paratam ...",2026-03-02 03:58:42+00:00
4782bb6a29ddfd4755c67bc52f0ec295,2026-02-23T17:26:00Z,'tsunami',www.popularmechanics.com,en,0.9,A Mountain Secretly Collapsed in Greenland. And Then the Earth Rang Like a Bell for 9 Straight Days.,NASA technology traced the pulsing back to a massive tsunami.,https://www.popularmechanics.com/science/environment/a70465538/greenland-megatsunami-waves-mystery/,https://s.yimg.com/ny/api/res/1.2/X6ffPS3hfZjhuq7lrcuLfQ--/YXBwaWQ9aGlnaGxhbmRlcjt3PTEyMDA7aD02NzU7Y2Y9d2VicA--/https://media.zenfs.com/en/popular_mechanics_642/5836466a07557d53e73c921931e8a9b3,,"""Hearst Magazines and Yahoo may earn commission or revenue on some items through these links.""
Heres what youll learn when you read this story:
<ul><li>Strange signals coming from the Arctic in 202… [+4309 chars]",,Ein Berg ist in Grönland heimlich eingestürzt. Und dann läutete die Erde neun Tage lang wie eine Glocke. Die NASA-Technologie führte das Pulsieren auf einen massiven Tsunami zurück.,A Mountain Secretly Collapsed in Greenland. And Then the Earth Rang Like a Bell for 9 Straight Days.. NASA technology traced the pulsing back to a massive tsunami.,Mons Clam in Groenlandiae concidit. Et terra sonuit sicut campanula pro 9 rectis diebus.,2026-03-05 20:20:00+00:00
23ab067f4515c777b189f8c343555067,2026-02-12T14:50:18Z,'tsunami',mymodernmet.com,en,0.7,The ”Tsunami Cake” Baking Trend Surrounds Figurines in Flowing Icing Skirts,"The ”Tsunami Cake” Baking Trend Surrounds Figurines in Flowing Icing Skirts
@foodie.beats Disney dress cake compilation #disney #dress #cake ♬ Aquarium – Kevin MacLeod From buttercream flowers to cat-shaped bread, baking offers plenty of opportunities to get …",https://mymodernmet.com/pull-me-up-cakes/,https://mymodernmet.com/wp/wp-content/uploads/2026/02/pull-me-up-cakes-thumbnail.jpg,http://web.archive.org/web/20260213235309/https://mymodernmet.com/pull-me-up-cakes/,"@foodie.beats Disney dress cake compilation #disney#dress#cake♬ Aquarium – Kevin MacLeod
From buttercream flowers to cat-shaped bread, baking offers plenty of opportunities to get creative. But one … [+3049 chars]",,"Der Backtrend „Tsunami-Kuchen“ umgibt Figuren mit fließenden Zuckergussröcken. Der Backtrend „Tsunami-Kuchen“ umgibt Figuren mit fließenden Zuckergussröcken
@foodie.beats Disney Dress Cake Compilation #disney #dress #cake ♬ Aquarium – Kevin MacLeod Von Buttercremeblumen bis hin zu Katzenbrot – Backen bietet viele Möglichkeiten, …","The ”Tsunami Cake” Baking Trend Surrounds Figurines in Flowing Icing Skirts. The ”Tsunami Cake” Baking Trend Surrounds Figurines in Flowing Icing Skirts
@foodie.beats Disney dress cake compilation #disney #dress #cake ♬ Aquarium – Kevin MacLeod From buttercream flowers to cat-shaped bread, baking offers plenty of opportunities to get …","""Tsunami placentam"" Pistoria Fossa circumscribit figurae in Flumine alis. Quod ""Tsunami Rutrum"" Pistoria Fossa circuit figurae in Fluente vico alis
@foodie.beats Disney vestis placentae compilatio #disney #dress #cake Aquarium – Kevin MacLeod Ex buttercream florum ad panem catum formatum, multa occasiones ad coquendum praebet…",2026-03-07 19:51:27+00:00
2d1219730444012d4fc773bc00c087e9,2026-02-24T21:00:01Z,'tsunami',www.punknews.org,en,0.7,Tsunami Bomb announce PNW shows,Tsunami Bomb have announced four shows. They'll be hanging around the North West for four gigs in April. You can see the show info below....,https://www.punknews.org/article/87658/tsunami-bomb-announce-pnw-shows,https://static.punknews.org/images/bands/tsunamibomb-1571749714.jpg,http://web.archive.org/web/20260225010633/https://www.punknews.org/article/87658/tsunami-bomb-announce-pnw-shows,Tsunami Bomb have announced four shows. They'll be hanging around the North West for four gigs in April. You can see the show info below.,,Tsunami Bomb kündigen PNW-Shows an. Tsunami Bomb haben vier Shows angekündigt. Im April werden sie vier Auftritte im Nordwesten verbringen. Die Infos zur Show könnt ihr unten sehen....,Tsunami Bomb announce PNW shows. Tsunami Bomb have announced four shows. They'll be hanging around the North West for four gigs in April. You can see the show info below....,Tsunami Bomb nuntiare PNW ostendit. Tsunami Bomb nuntiaverunt quattuor spectacula. Circa aquilonem occidentalem quattuor gigas mense Aprili pendent. Info infra spectaculum videre potes.,2026-03-07 19:51:27+00:00
e59107d2d697dd70a5c126becc968314,2026-02-27T15:14:09Z,'tsunami',futurism.com,en,0.7,Anthropic CEO Warns of “Tsunami” on Horizon,"""There doesn't seem to be a wider recognition in society of what's about to happen.""
The post Anthropic CEO Warns of “Tsunami” on Horizon appeared first on Futurism.",http://futurism.com/artificial-intelligence/anthropic-ceo-warns-tsunami,https://futurism.com/wp-content/uploads/2026/02/anthropic-ceo-warns-tsunami.jpg?w=1200,http://web.archive.org/web/20260227192605/https://futurism.com/artificial-intelligence/anthropic-ceo-warns-tsunami,"Can’t-miss innovations from the bleeding edge of science and tech
Dario Amodei may boast many credentials, but we weren’t aware that meteorologist was one of them.
This week, the Anthropic CEO warn… [+2927 chars]",,"Anthropic-CEO warnt vor „Tsunami“ am Horizont. „In der Gesellschaft scheint es keine breitere Anerkennung dessen zu geben, was passieren wird.“
Der Beitrag Anthropic CEO warnt vor „Tsunami“ auf Horizon erschien zuerst auf Futurism.","Anthropic CEO Warns of “Tsunami” on Horizon. ""There doesn't seem to be a wider recognition in society of what's about to happen.""
The post Anthropic CEO Warns of “Tsunami” on Horizon appeared first on Futurism.","Anthropica CEO Monet de ""Tsunami"" in Horizonte. ""Non videtur latius agnosci in societate eorum quae ventura sunt"".
Post Anthropicum CEO Monet ""Tsunami"" in Horizonte primum apparuit in Futurismo.",2026-03-07 19:51:27+00:00
