index,published,keyword,domain,language,valid,title,description,url,image,archive,content,quote,de,en,la,added
cadbc27d65df83f05701dd9dd784a452,2026-02-04T20:13:13Z,'tsunami',theeconomiccollapseblog.com,en,0.7,Deep Cuts: We Are Witnessing A Tsunami Of Very Painful Layoffs And Closings In 2026,"Do you remember the endless barrage of layoffs and store closings that we experienced during the Great Recession?  Well, it is starting to happen again.  All over the country, large employers are bringing down the axe really hard.  For those that have been la…",http://theeconomiccollapseblog.com/deep-cuts-we-are-witnessing-a-tsunami-of-very-painful-layoffs-and-closings-in-2026/,http://theeconomiccollapseblog.com/wp-content/uploads/2026/02/Snip20260204_36.png,http://web.archive.org/web/20260204233519/http://theeconomiccollapseblog.com/deep-cuts-we-are-witnessing-a-tsunami-of-very-painful-layoffs-and-closings-in-2026/,"Do you remember the endless barrage of layoffs and store closings that we experienced during the Great Recession?  Well, it is starting to happen again.  All over the country, large employers are bri… [+9845 chars]",,"Tiefgreifende Einschnitte: Im Jahr 2026 erleben wir einen Tsunami sehr schmerzhafter Entlassungen und Schließungen. Erinnern Sie sich an die endlose Flut von Entlassungen und Ladenschließungen, die wir während der Großen Rezession erlebt haben?  Nun, es beginnt wieder zu passieren.  Überall im Land greifen große Arbeitgeber mit aller Härte zur Rechenschaft.  Für diejenigen, die la…","Deep Cuts: We Are Witnessing A Tsunami Of Very Painful Layoffs And Closings In 2026. Do you remember the endless barrage of layoffs and store closings that we experienced during the Great Recession?  Well, it is starting to happen again.  All over the country, large employers are bringing down the axe really hard.  For those that have been la…","Profunda Cuts: Nos testamur Tsunami Gravissimas laicorum et clausuras in 2026. Meministine sine fine verberare laicorum et clausuras repositas quas in Magno recessu experti sumus?  Bene, incipit iterum fieri.  Totam per villam, magnae mus deducunt securim vere duram.  Nam ea quae la...",2026-02-17 08:26:22+00:00
2877972202b4cada6d587a0a19657d52,2026-02-12T18:52:43Z,'tsunami',www.metalunderground.com,en,0.7,"Ape Vermin Shares New Lyric Video ""Awakened""","North Carolina’s progressive sludge metal juggernaut Ape Vermin has released a brand-new lyric video for ""Awakened,"" the eighth and most explosive track from their latest album, ""Andromedas Colossus."" The video was crafted by Kenji Tsunami of Tsunami Films, k…",http://www.metalunderground.com/news/details.cfm?newsid=160811,https://www.metalunderground.com/assets/icons/horns-512.png,,"posted
Feb12,2026 at 
1:52 PM
by Diamond Oz.
 (0 Comments)
North Carolinas progressive sludge metal juggernaut Ape Vermin has released a brand-new lyric video for ""Awakened,"" the eighth and most… [+992 chars]",,"Ape Vermin teilt neues Lyric-Video „Awakened“. North Carolinas Progressive-Sludge-Metal-Moloch Ape Vermin hat ein brandneues Lyric-Video zu „Awakened“ veröffentlicht, dem achten und explosivsten Titel ihres neuesten Albums „Andromedas Colossus“. Das Video wurde von Kenji Tsunami von Tsunami Films erstellt, k…","Ape Vermin Shares New Lyric Video ""Awakened"". North Carolina’s progressive sludge metal juggernaut Ape Vermin has released a brand-new lyric video for ""Awakened,"" the eighth and most explosive track from their latest album, ""Andromedas Colossus."" The video was crafted by Kenji Tsunami of Tsunami Films, k…","Ape Vermin New Lyric Video ""Excitatus"". Progressivus pituitae metallicae Carolinae septentrionalis iuggernaut Ape Vermin dimisit video notam lyricam pro ""Excitatus"" octavum et explosivum album e vestigio recentissimo, ""Andromedas Colossus."" Video fabricatum a Kenji Tsunami de Tsunami Films, k ...",2026-02-17 08:26:22+00:00
71e54088f92c86aef5a0ff2b23fb3421,2026-02-04T17:09:53Z,'tsunami',newsonjapan.com,en,0.9,3D Images Reveal How Tsunami Fires Spread,"High-resolution 3D images created from aerial photographs taken after the Great East Japan Earthquake have revealed how large-scale fires spread in the aftermath of the tsunami, showing that in Yamada Town, Iwate Prefecture, debris left behind by the waves co…",https://newsonjapan.com/article/148302.php,https://i2.ytimg.com/vi/-gzM3PY2qac/mqdefault.jpg,http://web.archive.org/web/20260204190502/https://newsonjapan.com/article/148302.php,"TOKYO, Feb 05 (News On Japan) -
 High-resolution 3D images created from aerial photographs taken after the Great East Japan Earthquake have revealed how large-scale fires spread in the aftermath of … [+3573 chars]",,"3D-Bilder zeigen, wie sich Tsunami-Brände ausbreiten. Hochauflösende 3D-Bilder, die aus Luftaufnahmen nach dem großen Erdbeben in Ostjapan erstellt wurden, haben gezeigt, wie sich große Brände nach dem Tsunami ausbreiteten, und zeigten, dass in der Stadt Yamada in der Präfektur Iwate von den Wellen zurückgelassene Trümmer zurückblieben…","3D Images Reveal How Tsunami Fires Spread. High-resolution 3D images created from aerial photographs taken after the Great East Japan Earthquake have revealed how large-scale fires spread in the aftermath of the tsunami, showing that in Yamada Town, Iwate Prefecture, debris left behind by the waves co…","3D Imagines revela quomodo Tsunami Fires Expande. Summus resolutio 3D imagines ex imaginibus aereis sumptis post Magnum Orientem Iaponiae Terrae motus creatis patefecerunt quam magnae incendia in reparatione tsunami propagata sunt, ostendens in Yamada Oppido, Iwate Praefectura, obruta ab undis co… relicta.",2026-02-17 08:26:22+00:00
e14bbcf8e75a022b5afa082d7fa10407,2026-02-16T16:25:47Z,'tsunami warning',theconversation.com,en,0.9,How 1.5 million km of undersea internet cables can double up as an earthquake and tsunami warning system,Existing underwater fibre optic cables could help monitor tectonic movement on the ocean floor.,https://theconversation.com/how-1-5-million-km-of-undersea-internet-cables-can-double-up-as-an-earthquake-and-tsunami-warning-system-274644,https://images.theconversation.com/files/718014/original/file-20260212-56-n8t808.jpeg?ixlib=rb-4.1.0&rect=0%2C571%2C3879%2C1939&q=45&auto=format&w=1356&h=668&fit=crop,http://web.archive.org/web/20260216183822/https://theconversation.com/how-1-5-million-km-of-undersea-internet-cables-can-double-up-as-an-earthquake-and-tsunami-warning-system-274644,"Mayumi.K.Photography/Shutterstock
Forecasting earthquakes presents a serious challenge on land, but in the oceans that cover around 70% of the Earth’s surface it is all but impossible. However, the … [+6932 chars]",,"Wie 1,5 Millionen Kilometer Unterwasser-Internetkabel als Erdbeben- und Tsunami-Warnsystem fungieren können. Bestehende Unterwasser-Glasfaserkabel könnten dabei helfen, tektonische Bewegungen auf dem Meeresboden zu überwachen.",How 1.5 million km of undersea internet cables can double up as an earthquake and tsunami warning system. Existing underwater fibre optic cables could help monitor tectonic movement on the ocean floor.,Quomodo 1.5 miliones chiliometrorum funalium interrete underseae duplicare possunt sicut ratio terrae motus et tsunami monitionis. Funes optici fibra sub aqua exsistens monitorem tectonicum in area Oceani adiuvare potuit.,2026-02-18 04:06:35+00:00
7c4fc9dd46f12f740496ce6feaedaa61,2026-02-13T19:25:40Z,'tsunami',www.irishtimes.com,en,0.9,Social Democrats apologise to former justice minister over false Epstein files accusation,Alan Shatter says Gary Gannon’s post led to a ‘tsunami of invective and antisemitic abuse’,https://www.irishtimes.com/politics/2026/02/13/social-democrats-apologise-to-former-justice-minister-over-false-epstein-files-accusation/,https://www.irishtimes.com/resizer/v2/ON2XYH6US4JUMC6TV6RDDHBJMY.JPG?smart=true&auth=d4b50b4c9d048372e5127fb84240e4afe120fafe1db81b4a7717ceefb3b37235&width=1200&height=630,,The Social Democrats and party TD Gary Gannon have apologised and agreed to pay damages to former minister for justice Alan Shatter following a social media post relating to the Jeffrey Epstein files… [+2220 chars],,"Sozialdemokraten entschuldigen sich beim ehemaligen Justizminister wegen falscher Epstein-Anschuldigungen. Alan Shatter sagt, Gary Gannons Post habe zu einem „Tsunami aus Beschimpfungen und antisemitischen Beschimpfungen“ geführt",Social Democrats apologise to former justice minister over false Epstein files accusation. Alan Shatter says Gary Gannon’s post led to a ‘tsunami of invective and antisemitic abuse’,Democratae sociales deprecarentur ut minister iustitiae pristinae de falsis Epifanie fasciculis accusaretur. Alan Shatter dicit Gary Gannon nuntium ductum esse ad 'tsunami de abusu invectiva et antisemitica'.,2026-02-18 08:25:17+00:00
f36e03da814909e70a73bbfff77217cf,2026-02-18T19:24:24Z,'tsunami damages',www.abc.net.au,en,0.3,Could Ashton Hurn lose her seat at the next election?,"It's an almost unthinkable scenario, but the fact it's even being discussed shows the extent of the Liberal Party's predicament.",https://www.abc.net.au/news/2026-02-19/could-ashton-hurn-lose-her-seat-at-the-next-sa-election/106357818,https://live-production.wcms.abc-cdn.net.au/709429a22a1c25df997f14de5858fdc2?impolicy=wcms_watermark_news&cropH=2411&cropW=4286&xPos=0&yPos=43&width=862&height=485&imformat=generic,,"A rising Malinauskas tide is poised to lift all Labor candidates' boats at next month's state election.
But it would have to be an utter tsunami for Liberal Party leader Ashton Hurn to be washed awa… [+4114 chars]",,"Könnte Ashton Hurn bei der nächsten Wahl ihren Sitz verlieren? Es ist ein fast undenkbares Szenario, aber die Tatsache, dass es überhaupt diskutiert wird, zeigt das Ausmaß der misslichen Lage der Liberalen Partei.","Could Ashton Hurn lose her seat at the next election?. It's an almost unthinkable scenario, but the fact it's even being discussed shows the extent of the Liberal Party's predicament.","Potuitne Aston Hurn sedem suam amittere in proxima electione? Smissio paene inexcogitabilis est, sed res ipsa etiam de qua agitur ostendit extensionem praedicamenti Partis Liberalis.",2026-02-20 08:07:53+00:00
155b7d125738970c6fa7dc7212d9700d,2026-02-18T09:36:16Z,'tsunami',pypi.org,en,0.7,tsu-wave 1.0.0,TSU-WAVE: Tsunami Spectral Understanding of Wave-Amplitude Variance and Energy,https://pypi.org/project/tsu-wave/1.0.0/,,,"A required part of this site couldnt load. This may be due to a browser
 extension, network issues, or browser settings. Please check your
 connection, disable any ad blockers, or try using a diffe… [+12 chars]",,Tsu-Welle 1.0.0. TSU-WAVE: Tsunami-Spektralverständnis der Wellenamplitudenvarianz und -energie,tsu-wave 1.0.0. TSU-WAVE: Tsunami Spectral Understanding of Wave-Amplitude Variance and Energy,tsu-unda 1.0.0. TSU-fluctus: Tsunami Spectralis intellectus Undo-Amplitudo Variance et Energy,2026-02-20 08:07:53+00:00
ba0ce63ee73d2a808b521ac19322c27d,2026-02-16T05:52:57Z,'tsunami',freerepublic.com,en,0.9,The Volcano That Could Wipe Out the Greek Islands | Volcano Documentary [44:43],"This active volcano still spews gas -- and a major eruption could trigger a deadly tsunami. Locals live in its shadow, knowing history could repeat itself. Nisyros is a small, volcanic island and municipality in the Dodecanese group of islands in the Aegean S…",https://freerepublic.com/focus/f-chat/4367022/posts,,http://web.archive.org/web/20260216135533/https://freerepublic.com/focus/f-chat/4367022/posts,"Skip to comments.
The Volcano That Could Wipe Out the Greek Islands | Volcano Documentary [44:43]YouTube ^
 | December 9, 2025
 | Autentic Documentary (inauthentic spelling?)
Posted on 02/15/2026… [+1057 chars]",,"Der Vulkan, der die griechischen Inseln auslöschen könnte | Vulkandokumentation [44:43]. Dieser aktive Vulkan spuckt immer noch Gas – und ein großer Ausbruch könnte einen tödlichen Tsunami auslösen. Die Einheimischen leben in seinem Schatten und wissen, dass sich die Geschichte wiederholen könnte. Nisyros ist eine kleine Vulkaninsel und Gemeinde in der Dodekanes-Inselgruppe in der Ägäis.","The Volcano That Could Wipe Out the Greek Islands | Volcano Documentary [44:43]. This active volcano still spews gas -- and a major eruption could trigger a deadly tsunami. Locals live in its shadow, knowing history could repeat itself. Nisyros is a small, volcanic island and municipality in the Dodecanese group of islands in the Aegean S…","Volcano, quod deleri potuerit, insulas Graecas | Volcano documentali [44:43]. Hoc activum vulcanus gasum adhuc vomit - et maior eruptio tsunami lethalem efficere potuit. Incolis umbrae vivunt, cognoscentes historiam se repetere posse. Nisyros parva, mola insula et municipium est in Dodecanesi insularum numero in Aegaeo S…",2026-02-20 08:07:53+00:00
b9c645e36e69e8720eb1150bd9464dbf,2026-02-17T05:30:00Z,'tsunami',www.independent.ie,en,0.9,‘Fukushima: Days That Shocked the World’ review: Powerful series revisits Japan’s earthquake and tsunami tragedy,It’s been 15 years since Japan was hit by the most powerful earthquake in the country’s history.,https://www.independent.ie/entertainment/television/tv-reviews/fukushima-days-that-shocked-the-world-review-powerful-series-revisits-japans-earthquake-and-tsunami-tragedy/a803689306.html,https://focus.independent.ie/thumbor/Zn7P0A9huu9Wi-WvlwZzrlcZgd0=/275x0:3249x1983/629x0/prod-mh-ireland/eb874182-b31d-4aff-8e62-42689c821603/eb6f1915-9487-4530-b11d-7be7850c749e/eb874182-b31d-4aff-8e62-42689c821603.jpg,,"The human tragedies and environmental consequences of Japans most powerful earthquake in 2011, which caused a disaster at Fukushima nuclear plant
Its been 15 years since Japan was hit by the most po… [+310 chars]",,"Rezension zu „Fukushima: Tage, die die Welt schockierten“: Kraftvolle Serie greift Japans Erdbeben- und Tsunami-Tragödie auf. Es ist 15 Jahre her, dass Japan vom stärksten Erdbeben in der Geschichte des Landes heimgesucht wurde.",‘Fukushima: Days That Shocked the World’ review: Powerful series revisits Japan’s earthquake and tsunami tragedy. It’s been 15 years since Japan was hit by the most powerful earthquake in the country’s history.,'Fukushima: Dies Qui perculsi recognitionem Mundi: Potens series terrae motus et tsunami tragoedia Iaponia revisit. XV annos fuit ex quo Iaponia a potentissimo terrae motu in historia patriae ictus est.,2026-02-20 08:07:53+00:00
197563df6359b45aeeb44bb28dc0f543,2026-02-17T18:08:29Z,'tsunami',www.unexplained-mysteries.com,en,0.9,Undersea cables could serve as a tsunami early warning system,There are roughly 1.5 million kilometers of cables currently stretching across the world's ocean floors. Marc-Andre Gutscher: Forecasting earthquakes ...,https://www.unexplained-mysteries.com/news/394856/undersea-cables-could-serve-as-a-tsunami-early-warning-system,https://www.unexplained-mysteries.com/images/news_large_retina/news-hq-green-ocean.jpg,,"Science &amp; Technology
February 17, 2026 ·  0 commentsUndersea cables can serve more than one purpose. Image Credit: CC BY-SA 3.0 BabiesanThere are roughly 1.5 million kilometers of cables current… [+6371 chars]",,"Unterseekabel könnten als Tsunami-Frühwarnsystem dienen. Derzeit erstrecken sich rund 1,5 Millionen Kilometer Kabel über den Meeresboden der Welt. Marc-Andre Gutscher: Erdbeben vorhersagen ...",Undersea cables could serve as a tsunami early warning system. There are roughly 1.5 million kilometers of cables currently stretching across the world's ocean floors. Marc-Andre Gutscher: Forecasting earthquakes ...,Funes Undersea pro tsunami praenuntia rationi inservire poterant. Sunt circiter 1.5 miliones chiliometrorum e ruderum nunc trans tabulata oceani mundi tendentes. Marc-Andre Gutscher: Terrarum motus praenuntiatio .,2026-02-20 08:07:53+00:00
7c097335104497394b184128778eb1bb,2026-02-18T02:03:04Z,'tsunami',post.rlsbb.to,en,0.9,Fukushima Days That Shocked the World S01E01 1080p HDTV H264-DARKFLiX,"Survivors and witnesses recall March 11 2011 – when Japan was hit by a devastating tsunami of 40-foot waves, killing 20,000 and triggering a nuclear meltdown.Season 1, Episode 01 – On March 11, 2011, Japan was rocked by a devastating tsunami, killing 20,000 a…",https://post.rlsbb.to/fukushima-days-that-shocked-the-world-s01e01-1080p-hdtv-h264-darkflix/,,,"Survivors and witnesses recall March 11 2011 – when Japan was hit by a devastating tsunami of 40-foot waves, killing 20,000 and triggering a nuclear meltdown.
Season 1, Episode 01 On March 11, 2011,… [+761 chars]",,"Fukushima-Tage, die die Welt schockierten S01E01 1080p HDTV H264-DARKFLiX. Überlebende und Zeugen erinnern sich an den 11. März 2011 – als Japan von einem verheerenden Tsunami mit 40 Fuß hohen Wellen heimgesucht wurde, der 20.000 Menschen tötete und eine Kernschmelze auslöste. Staffel 1, Folge 01 – Am 11. März 2011 wurde Japan von einem verheerenden Tsunami erschüttert, der 20.000 Menschen tötete …","Fukushima Days That Shocked the World S01E01 1080p HDTV H264-DARKFLiX. Survivors and witnesses recall March 11 2011 – when Japan was hit by a devastating tsunami of 40-foot waves, killing 20,000 and triggering a nuclear meltdown.Season 1, Episode 01 – On March 11, 2011, Japan was rocked by a devastating tsunami, killing 20,000 a…","Fukushima Dies Mundi S01E01 1080p perculsus HDTV H264-DARKFLiX. Superstites et testes recolunt Martii 11 2011 – cum Iaponia per vastitatem tsunami fluctuum quadraginta pedum quadraginta ictus est, viginti milia necavit et nuclei meltdown.Season 1, Episode 01 – Kalendis Martiis 2011, Iaponia a vastatione tsunami agitata est, viginti milia a… necavit.",2026-02-20 08:07:53+00:00
04e0dacc0929ef004bd0b83fbf24f377,2026-02-18T05:43:01Z,'tsunami',post.rlsbb.to,en,0.9,The Impossible 2012 1080p AMZN WEB-DL H264-Kitsune,Lo imposible (original title) - Nominated for 1 Oscar 28 wins & 70 nominations total See more awards » Plot: The story of a tourist family in Thailand caught in the destruction and chaotic aftermath of the 2004 Indian Ocean tsunami. Genre: Drama | History | T…,https://post.rlsbb.to/the-impossible-2012-1080p-amzn-web-dl-h264-kitsune/,,,"Lo imposible (original title) – Nominated for 1 Oscar 28 wins &amp; 70 nominations total See more awards »
Plot: The story of a tourist family in Thailand caught in the destruction and chaotic after… [+1014 chars]",,"The Impossible 2012 1080p AMZN WEB-DL H264-Kitsune. Lo imposible (Originaltitel) – Nominiert für 1 Oscar, insgesamt 28 Siege und 70 Nominierungen Weitere Auszeichnungen » Handlung: Die Geschichte einer Touristenfamilie in Thailand, die von der Zerstörung und den chaotischen Folgen des Tsunamis im Indischen Ozean 2004 betroffen ist. Genre: Drama | Geschichte | T…",The Impossible 2012 1080p AMZN WEB-DL H264-Kitsune. Lo imposible (original title) - Nominated for 1 Oscar 28 wins & 70 nominations total See more awards » Plot: The story of a tourist family in Thailand caught in the destruction and chaotic aftermath of the 2004 Indian Ocean tsunami. Genre: Drama | History | T…,Impossibile 2012 1080p AMZN VUL-DL H264-Kitsune. Lo imposible (originale titulus) - Nominati pro 1 Oscar 28 vincit & 70 nominationes totales Sedes plura praemia » Plot: Historia peregrinationis familiae in Thailandia deprehensa in pernicie et chaotica reparatione 2004 Oceani Indici tsunami. Genre: Drama | History | T…,2026-02-20 08:07:53+00:00
7d2f9e19e0cd09ffe8c01d665f1359a0,2026-02-18T12:43:26Z,'tsunami warning',crooksandliars.com,en,0.9,"Hey, Corporate America! Here Come The Congressional Subpoenas","Partners in Vianovo, a bipartisan communications firm are warning clients of a ""tsunami"" of Congressional oversight if the Dems win the House in November.
""It's going to be so much worse than they expect,"" Matthew Miller told Axios. Companies ""that prepare in…",https://crooksandliars.com/2026/02/hey-corporate-america-here-come,https://crooksandliars.com/files/primary_image/26/02/chad-stembridge-arv5pa5e9bg-unsplash.jpg,http://web.archive.org/web/20260218152044/https://crooksandliars.com/2026/02/hey-corporate-america-here-come,"Partners in Vianovo, a bipartisan communications firm are warning clients of a ""tsunami"" of Congressional oversight if the Dems win the House in November.
""It's going to be so much worse than they e… [+937 chars]",,"Hey, Corporate America! Hier kommen die Vorladungen des Kongresses. Partner von Vianovo, einem überparteilichen Kommunikationsunternehmen, warnen ihre Kunden vor einem „Tsunami“ der Kontrolle durch den Kongress, wenn die Demokraten im November das Repräsentantenhaus gewinnen.
„Es wird viel schlimmer kommen, als sie erwarten“, sagte Matthew Miller zu Axios. Unternehmen, „die sich in… vorbereiten“","Hey, Corporate America! Here Come The Congressional Subpoenas. Partners in Vianovo, a bipartisan communications firm are warning clients of a ""tsunami"" of Congressional oversight if the Dems win the House in November.
""It's going to be so much worse than they expect,"" Matthew Miller told Axios. Companies ""that prepare in…","Hey, Corporate America! Hic Veni Subpoenas Concilii. Socii in Vianovo, firmi communicationis bipartisanae clientes ""tsunami"" praesidentis Concilii admonent si Dems domum mense Novembri vincat.
""Tanto peius futurum est quam sperant"" Matthaeus Miller Axios dixit. Societates ""quae in ... parant.",2026-02-20 08:07:53+00:00
6b12a9238af89d8943a6342fcacf7eba,2026-02-19T03:35:19Z,'tsunami',post.rlsbb.to,en,0.9,Fukushima Days That Shocked the World S01E02 1080p HDTV H264-DARKFLiX,"Season 1, Episode 02 – Survivors and witnesses recall 11 March 2011, when Japan was hit by a devastating tsunami of 40-foot waves, killing 20,000 people and triggering a nuclear meltdown Links: HOMEPAGE – TVMFukushima.Days.That.Shocked.The.World.S01E02.1080p.…",https://post.rlsbb.to/fukushima-days-that-shocked-the-world-s01e02-1080p-hdtv-h264-darkflix/,,,"Season 1, Episode 02 Survivors and witnesses recall 11 March 2011, when Japan was hit by a devastating tsunami of 40-foot waves, killing 20,000 people and triggering a nuclear meltdown
Links:HOMEPAG… [+365 chars]",,"Fukushima-Tage, die die Welt schockierten S01E02 1080p HDTV H264-DARKFLiX. Staffel 1, Folge 02 – Überlebende und Zeugen erinnern sich an den 11. März 2011, als Japan von einem verheerenden Tsunami mit 40 Fuß hohen Wellen heimgesucht wurde, der 20.000 Menschen tötete und eine Kernschmelze auslöste. Links: HOMEPAGE – TVMFukushima.Days.That.Shocked.The.World.S01E02.1080p.…","Fukushima Days That Shocked the World S01E02 1080p HDTV H264-DARKFLiX. Season 1, Episode 02 – Survivors and witnesses recall 11 March 2011, when Japan was hit by a devastating tsunami of 40-foot waves, killing 20,000 people and triggering a nuclear meltdown Links: HOMEPAGE – TVMFukushima.Days.That.Shocked.The.World.S01E02.1080p.…","Fukushima Diebus quibus perculsus Mundus S01E02 1080p HDTV H264-DARKFLiX. Temporum 1, Episode 02 – Superstites et testes recolunt XI Martii MMXI, cum Iaponia per vastitatem tsunami fluctuum 40 pedum percussa est, viginti milia hominum necavit et nuclei liquefactionis nexus excitat: HOMEPAGE – TVMFukushima. Days.That.Shocked.The.World.S01E02.1080p.…",2026-02-20 08:07:53+00:00
bd7ff4599ad72aa0288fb1b26e6589f5,2026-02-19T05:01:00Z,'tsunami',www.challies.com,en,0.9,A La Carte (February 19),"A La Carte: Save the fox, kill the fetus / Prayer meeting / Traits of great writers and artists / When productivity replaces trust / The silent killer / Brace yourself for the AI tsunami / and more.See Also
<ul><li>A La Carte (September 7)</li><li>A La Carte…",https://www.challies.com/a-la-carte/a-la-carte-february-19-2026/,https://www.challies.com/media/2023/11/cover-a-la-carte-thu-a.jpg,,"Today’s Kindle deals include Gavin Ortlund’s excellent The Art of Disagreeing. Be sure to also consider Poythress’ Biblical Typology and Stark’s The Secret Place of Thunder.
(Yesterday on the blog: … [+2051 chars]",,"A La Carte (19. Februar). A La Carte: Rette den Fuchs, töte den Fötus / Gebetstreffen / Eigenschaften großer Schriftsteller und Künstler / Wenn Produktivität Vertrauen ersetzt / Der stille Killer / Machen Sie sich bereit für den KI-Tsunami / und mehr. Siehe auch
<ul><li>A La Carte (7. September)</li><li>A La Carte…","A La Carte (February 19). A La Carte: Save the fox, kill the fetus / Prayer meeting / Traits of great writers and artists / When productivity replaces trust / The silent killer / Brace yourself for the AI tsunami / and more.See Also
<ul><li>A La Carte (September 7)</li><li>A La Carte…","A La Carte (19 Februarii). A La Carte: Serva vulpem, occide foetum / Orationis congressum / Extraits magnorum scriptorum et artificum / Cum fructibus substituit fiduciam / tacitum interfectorem / accinge te ad AI tsunami / et more.See Quoque
<ul><li>A La Carte (VII Septembris</li><li>A La Carte...",2026-02-20 08:07:53+00:00
