index,published,keyword,domain,language,valid,title,description,url,image,archive,content,quote,de,en,la,added
aa9d669bc381b511c127024a29e79907,2026-06-17T09:09:51Z,'tsunami',en.antaranews.com,en,0.9,Palu 6.7-magnitude quake carries no tsunami threat: BNPB,"The National Disaster Mitigation Agency (BNPB) confirmed that no tsunami occurred after the 6.7-magnitude earthquake rattled Palu, Central Sulawesi, on ...",https://en.antaranews.com/news/419420/palu-67-magnitude-quake-carries-no-tsunami-threat-bnpb,https://cdn.antaranews.com/cache/1200x800/2026/06/17/1781668723267_copy_2872x1916.jpg,,"<ul><li> June 17, 2026 16:09 GMT+700</li></ul>
Jakarta (ANTARA) - The National Disaster Mitigation Agency (BNPB) confirmed that no tsunami occurred after the 6.7-magnitude earthquake rattled Palu, C… [+2394 chars]",,"Palu-Beben der Stärke 6,7 birgt keine Tsunami-Gefahr: BNPB. Die National Disaster Mitigation Agency (BNPB) bestätigte, dass kein Tsunami aufgetreten sei, nachdem das Erdbeben der Stärke 6,7 Palu, Zentral-Sulawesi, am ... erschüttert hatte.","Palu 6.7-magnitude quake carries no tsunami threat: BNPB. The National Disaster Mitigation Agency (BNPB) confirmed that no tsunami occurred after the 6.7-magnitude earthquake rattled Palu, Central Sulawesi, on ...","Palu 6.7-motus magni- tsunami non fert minas: BNPB. In National clade Mitigationis Agency (BNPB) confirmavit nullum tsunami factum post 6.7-magnitudinem terrae motus Palu, Central Sulawesi repulsa, in ...",2026-06-23 10:49:23+00:00
c608a3305439906147662fe38c987ab4,2026-06-17T10:30:46Z,'tsunami',spacedaily.com,en,0.9,"The number of people living past the age of 80 worldwide is projected to triple by 2050 — from approximately 145 million today to roughly 426 million — making the over-80 cohort the fastest-growing demographic on the planet, in a civilizational shift now widely referred to as “the silver tsunami” and that researchers expect to redefine almost everything we associate with the structure of human society","The 80-year-old is, in historical terms, an unusual phenomenon. For most of recorded human existence, the average life expectancy at birth sat somewhere between 25 and 35 years, primarily because of childhood mortality. Even adults who survived to reproductiv…",https://spacedaily.com/d-the-number-of-people-living-past-the-age-of-80-worldwide-is-projected-to-triple-by-2050-from-approximately-145-million-today-to-roughly-426-million-making-the-over-80-cohort-the-fa/,https://spacedaily.com/wp-content/uploads/2026/06/Posts-1600840-2026-06-17T105344.431.png,http://web.archive.org/web/20260618102508/https://spacedaily.com/d-the-number-of-people-living-past-the-age-of-80-worldwide-is-projected-to-triple-by-2050-from-approximately-145-million-today-to-roughly-426-million-making-the-over-80-cohort-the-fa/,"The 80-year-old is, in historical terms, an unusual phenomenon. For most of recorded human existence, the average life expectancy at birth sat somewhere between 25 and 35 years, primarily because of … [+7059 chars]",,"Schätzungen zufolge wird sich die Zahl der Menschen, die über 80 Jahre alt sind, weltweit bis zum Jahr 2050 verdreifachen – von heute etwa 145 Millionen auf etwa 426 Millionen. Damit ist die Kohorte der über 80-Jährigen die am schnellsten wachsende Bevölkerungsgruppe auf dem Planeten, ein zivilisatorischer Wandel, der heute allgemein als „Silber-Tsunami“ bezeichnet wird und von dem Forscher erwarten, dass er fast alles, was wir mit der Struktur der menschlichen Gesellschaft assoziieren, neu definieren wird. Der 80-Jährige ist historisch gesehen ein ungewöhnliches Phänomen. Während des größten Teils der menschlichen Existenz lag die durchschnittliche Lebenserwartung bei der Geburt zwischen 25 und 35 Jahren, hauptsächlich aufgrund der Kindersterblichkeit. Sogar Erwachsene, die bis zur Fortpflanzung überlebt haben …","The number of people living past the age of 80 worldwide is projected to triple by 2050 — from approximately 145 million today to roughly 426 million — making the over-80 cohort the fastest-growing demographic on the planet, in a civilizational shift now widely referred to as “the silver tsunami” and that researchers expect to redefine almost everything we associate with the structure of human society. The 80-year-old is, in historical terms, an unusual phenomenon. For most of recorded human existence, the average life expectancy at birth sat somewhere between 25 and 35 years, primarily because of childhood mortality. Even adults who survived to reproductiv…","Numerus hominum anteactae aetatis LXXX annorum in triplum proiectus est a MML — ab circiter CXLV miliones hodie ad CDXX decies centena milia — faciens super- 80 cohortem, quam celerrime crescens demographicus in planeta, in civili trabea nunc late appellata ""argentum tsunami"" et quod investigatores exspectant omnia paene omnia quae coniunguntur cum structura societatis humanae. LXXX annorum est, historicis verbis, phaenomenon insolitum. Ut plerique memoriae hominum exsistentiae, mediocris vitae exspectatio in nativitate alicubi inter 25 et 35 annos sedit, imprimis propter infantiam mortalitatem. Etiam adulti qui superfuerunt reproductiv...",2026-06-23 10:49:23+00:00
51fb9d874e9a23fe2f1cdad5432ee249,2026-06-17T22:22:57Z,'tsunami',wccftech.com,en,0.9,"Apple’s Tim Cook Cries Out That Memory Prices Have Become “Unsustainable,” Warns That “Unavoidable” Price Hikes Are Coming","Apple was, until recently, the last bastion of price stability even as a tsunami of memory-induced price hikes have continued to sweep across wide swathes of the global consumer electronics sphere. Alas! No longer. Apple now appears to have surrendered to the…",https://wccftech.com/apples-tim-cook-cries-out-that-memory-prices-have-become-unsustainable-warns-that-unavoidable-price-hikes-are-coming/,https://cdn.wccftech.com/wp-content/uploads/2026/05/M1-Max-transplant-performed-1.jpg,http://web.archive.org/web/20260618055122/https://wccftech.com/apples-tim-cook-cries-out-that-memory-prices-have-become-unsustainable-warns-that-unavoidable-price-hikes-are-coming/,"Apple was, until recently, the last bastion of price stability even as a tsunami of memory-induced price hikes have continued to sweep across wide swathes of the global consumer electronics sphere. A… [+2436 chars]",,"Tim Cook von Apple schreit, dass die Speicherpreise „unhaltbar“ geworden seien, und warnt davor, dass „unvermeidliche“ Preiserhöhungen bevorstehen. Apple war bis vor Kurzem die letzte Bastion der Preisstabilität, auch wenn ein Tsunami speicherbedingter Preiserhöhungen weiterhin weite Teile der globalen Unterhaltungselektronikbranche erfasste. Ach! Nicht mehr. Apple scheint nun kapituliert zu haben …","Apple’s Tim Cook Cries Out That Memory Prices Have Become “Unsustainable,” Warns That “Unavoidable” Price Hikes Are Coming. Apple was, until recently, the last bastion of price stability even as a tsunami of memory-induced price hikes have continued to sweep across wide swathes of the global consumer electronics sphere. Alas! No longer. Apple now appears to have surrendered to the…","Apple Tim Cook Clamat Ut Memoria Prices Fieri ""Unsustainable,"" monet ""Inevitabile"" Price Hikes Veniunt. Lacus usque nuper fuit, ultima bastion pretii stabilitatis etiam ut tsunami de pretio hikes memoriae inductae per latas fascias sphaerae electronicarum electronicarum globalis consumptor esse perseuerat. eheu! Non iam. Lacus nunc videtur dedidisse...",2026-06-23 10:49:23+00:00
8d02e29516a950a5e74f3caa6c4e3327,2026-06-18T08:11:10Z,'tsunami',biztoc.com,en,0.9,Planet Normal: Social Media Ban: Starmer finally gets something right | Podcast,The rocket of right thinking speeds around planet normal gathering the news tsunami of this week… Allison surprises Liam by ...,https://biztoc.com/x/7f02656e2d5928aa,https://biztoc.com/cdn/7f02656e2d5928aa_s.webp,,"The rocket of right thinking speeds around planet normal gathering the news tsunami of this week Allison surprises Liam by ...
This story appeared on youtube.com, 2026-06-18 08:00:29.",,Planet Normal: Social-Media-Verbot: Starmer macht endlich etwas richtig | Podcast. Die Rakete des richtigen Denkens rast um den Planeten Normal und verbreitet den Nachrichten-Tsunami dieser Woche ... Allison überrascht Liam mit ...,Planet Normal: Social Media Ban: Starmer finally gets something right | Podcast. The rocket of right thinking speeds around planet normal gathering the news tsunami of this week… Allison surprises Liam by ...,Planet Normal: Social Media Ban: Starmer tandem aliquid rectum accipit | Podcast. Eruca rectae cogitationis celeritates circa planetas normales colligens nuntium tsunami huius hebdomadis ... Allison opprimit Liam per ...,2026-06-23 10:49:23+00:00
41389ff72abfef1cf889eca8a78f8141,2026-06-18T13:42:56Z,'tsunami',biztoc.com,en,0.9,From Philippine staple to global sensation: the rise of ube,"From Philippine staple to global sensation: the rise of ube
The country is struggling to keep up with soaring demand
IN KASA AND KIN, a Philippine restaurant in London, a violet glaze gleams atop a wobbling “ube tsunami cheesecake”. The sweet-toothed can also…",https://biztoc.com/x/75c0f80f29295983,https://biztoc.com/cdn/75c0f80f29295983_s.webp,,"From Philippine staple to global sensation: the rise of ubeThe country is struggling to keep up with soaring demandIN KASA AND KIN, a Philippine restaurant in London, a violet glaze gleams atop a wob… [+144 chars]",,"Vom philippinischen Grundnahrungsmittel zur globalen Sensation: der Aufstieg von Ube. Vom philippinischen Grundnahrungsmittel zur globalen Sensation: der Aufstieg von Ube
Das Land hat Mühe, mit der steigenden Nachfrage Schritt zu halten
IN KASA AND KIN, einem philippinischen Restaurant in London, schimmert eine violette Glasur auf einem wackelnden „Ube-Tsunami-Käsekuchen“. Naschkatzen können auch…","From Philippine staple to global sensation: the rise of ube. From Philippine staple to global sensation: the rise of ube
The country is struggling to keep up with soaring demand
IN KASA AND KIN, a Philippine restaurant in London, a violet glaze gleams atop a wobbling “ube tsunami cheesecake”. The sweet-toothed can also…","A stapula Philippinarum ad sensum globalem: ortum ube. A stapula Philippinarum ad sensum globalem: ortum ube
Luctantur ruri ut sursum nitatur postulatio
IN KASA ET KIN, caupona Philippina Londinii, vitreum violaceum lucet in nutare ""ube tsunami caseum cacuminum"". Dulcis dentata potest etiam…",2026-06-23 10:49:23+00:00
6bd75ade63a42059fec04ef4f223dfe5,2026-06-19T05:00:44Z,'tsunami',www.counterpunch.org,en,0.9,Juneteenth Poem 2026,"Ask me, there should be a bronze statue of Crispus Attucks standing up next to Bill Russell At city hall in Boston town Home of the great molasses disaster of 1919 The tsunami of bean sauce flooding past Paul Revere’s church near the future site of the specta…",https://www.counterpunch.org/2026/06/19/juneteenth-poem-2026/,https://www.counterpunch.org/wp-content/uploads/2021/06/cp-default-share.png,http://web.archive.org/web/20260623045208/https://www.counterpunch.org/2026/06/19/juneteenth-poem-2026/,"Ask me, there should be a bronze statue
of Crispus Attucks standing up next to Bill Russell
At city hall in Boston town
Home of the great molasses disaster of 1919
The tsunami of bean sauce flood… [+7366 chars]",,"Juneteenth Poem 2026. Fragen Sie mich, es müsste eine Bronzestatue von Crispus Attucks stehen, die neben Bill Russell steht. Im Rathaus von Boston. Heimat der großen Melassekatastrophe von 1919. Der Tsunami aus Bohnensoße strömte an der Kirche von Paul Revere vorbei, in der Nähe des künftigen Schauplatzes der Spektakel.","Juneteenth Poem 2026. Ask me, there should be a bronze statue of Crispus Attucks standing up next to Bill Russell At city hall in Boston town Home of the great molasses disaster of 1919 The tsunami of bean sauce flooding past Paul Revere’s church near the future site of the specta…","Juneteenth Poem 2026. Pete a me, debet esse statua aenea Crispi Attucks stans iuxta Bill Russell In aula urbana in oppido Bostoniensi Home magnae calamitatis molasses anni 1919 Tsunami fabae liquaminis inundationis praeteritae Pauli Revere ecclesiam prope futurum situs spectaculi…",2026-06-23 10:49:23+00:00
fc627dcc7b8368c6f192648555b7c02d,2026-06-21T12:30:00Z,'tsunami',finance.yahoo.com,en,0.9,"If you’re surprised by how well the stock market is doing, so is Jamie Dimon—he says there’s a ‘little tsunami’ heading for the economy","""I am surprised because I think that you have Ukraine, Iran, oil, Russia, and our relationship with China. That stuff is really important for the free world,...",https://finance.yahoo.com/markets/stocks/articles/surprised-well-stock-market-doing-123000855.html,https://s.yimg.com/lo/mysterio/api/B2C57E602212C46FA21E5993C54C72747DD744B99FF8F2ED359F518369D33E18/subgraphmysterio/resizefill_w1200_h800;quality_80;format_webp/https:%2F%2Fmedia.zenfs.com%2Fen%2Ffortune_175%2F9dda590471124869593f1594ae233721,http://web.archive.org/web/20260621211756/https://finance.yahoo.com/markets/stocks/articles/surprised-well-stock-market-doing-123000855.html,"Markets across the world have had plenty to worry about in the past decade. A global pandemic, a major war between Ukraine and Russia in Europe, steady inflation across major economies, including the… [+2509 chars]",,"Wenn Sie überrascht sind, wie gut sich der Aktienmarkt entwickelt, dann ist das auch Jamie Dimon – er sagt, dass ein „kleiner Tsunami“ auf die Wirtschaft zusteuert. „Ich bin überrascht, weil ich denke, dass es die Ukraine, den Iran, das Öl, Russland und unsere Beziehungen zu China gibt. Das ist wirklich wichtig für die freie Welt, …“","If you’re surprised by how well the stock market is doing, so is Jamie Dimon—he says there’s a ‘little tsunami’ heading for the economy. ""I am surprised because I think that you have Ukraine, Iran, oil, Russia, and our relationship with China. That stuff is really important for the free world,...","Si miraris quomodo bene mercatus mercatus agit, sic est Jamie Dimon — ait illic 'parum tsunami' petitio oeconomiae. ""Miror quod existimo te habere Ucrainam, Iran, oleum, Russiam et relationem nostram cum Sinis. Ista materia vere magni momenti est pro mundo libero,...",2026-06-23 21:19:51+00:00
ea8b96ceb1170c0ee96ab30fc2913f45,2026-06-16T12:24:35Z,'tsunami',fortune.com,en,0.9,Why accounting may look completely different by 2040,"AI, increasing regulatory complexity, and a looming ""silver tsunami"" are reshaping the skills required for success in accounting.",https://fortune.com/2026/06/16/why-accounting-completely-different-by-2040-cfo/,"https://fortune.com/img-assets/wp-content/uploads/2026/06/GettyImages-1494163023_153569.jpg?resize=1200,600",http://web.archive.org/web/20260616203052/https://fortune.com/2026/06/16/why-accounting-completely-different-by-2040-cfo/,"Good morning. The accounting profession has spent decades looking backward. By 2040, it may be defined by how well it looks ahead.Thats the core message behind Rise2040: Shaping the Future of Finance… [+7940 chars]",,"Warum das Rechnungswesen bis 2040 völlig anders aussehen könnte. KI, zunehmende regulatorische Komplexität und ein drohender „Silber-Tsunami“ verändern die Fähigkeiten, die für den Erfolg im Rechnungswesen erforderlich sind.","Why accounting may look completely different by 2040. AI, increasing regulatory complexity, and a looming ""silver tsunami"" are reshaping the skills required for success in accounting.","Quare ratio inspicere potest omnino dissimilia ab 2040. AI, complexionem regulatoriam augens, et prospectus ""argenti tsunami"" in arte retractandi, quae ad successum in ratiocinando requiruntur.",2026-06-26 10:38:37+00:00
4540e7579ff1f4daf15f7b3dd9e7caf5,2026-06-24T13:43:58Z,'tsunami',www.channelnewsasia.com,en,0.9,Malaysians feast as ‘durian tsunami’ sends prices tumbling,The price of Musang King durian dropped to as little as RM9 per kilogram.,https://www.channelnewsasia.com/asia/durians-malaysia-price-drops-musang-king-oversupply-6207201,"https://dam.mediacorp.sg/image/upload/s--x-bLxL8P--/c_crop,h_899,w_1599,x_1,y_111/c_fill,g_auto,h_676,w_1200/fl_relative,g_south_east,l_mediacorp:cna:watermark:2023-11:afp_watermark_14112023,w_0.1/f_auto,q_auto/v1/mediacorp/cna/image/2026/06/24/000_b83z93b.jpg?itok=1jQ6qvfa",http://web.archive.org/web/20260625070448/https://www.channelnewsasia.com/asia/durians-malaysia-price-drops-musang-king-oversupply-6207201,"Reports said on Wednesday the price of Musang King durian plummeted from around RM90 (US$22) per kilogram to as little as RM9. 
Other varieties, such as Black Thorn, have also dropped in price, acco… [+1274 chars]",,"Malaysier feiern, während der „Durian-Tsunami“ die Preise in den Keller treibt. Der Preis für Musang King Durian sank auf nur 9 RM pro Kilogramm.",Malaysians feast as ‘durian tsunami’ sends prices tumbling. The price of Musang King durian dropped to as little as RM9 per kilogram.,Malaysiani festum ut 'durian tsunami' mittit pretia decidentia. Pretium Musang regis durian quam minimum RM9 per kilogram omisit.,2026-06-26 10:38:37+00:00
9d4789009525ea71720b562b21e5264e,2026-06-24T23:06:15Z,'tsunami',japantoday.com,en,0.9,M6.9 quake hits northeastern Japan; no tsunami warning,"An earthquake with a preliminary magnitude of 6.9 struck northeastern Japan on Thursday, but no tsunami warning was issued, the weather agency said. The 7:30 a.m. quake measured upper 6 on the Japanese seismic intensity scale of 7 in Aomori Prefecture.",https://japantoday.com/category/national/urgent-m6.9-quake-hits-northeastern-japan-no-tsunami-warning,,http://web.archive.org/web/20260625050237/https://japantoday.com/category/national/urgent-m6.9-quake-hits-northeastern-japan-no-tsunami-warning,"An earthquake with a preliminary magnitude of 6.9 struck northeastern Japan on Thursday, but no tsunami warning was issued, the weather agency said.
The 7:30 a.m. quake measured upper 6 on the Japan… [+62 chars]",,"Erdbeben der Stärke M6.9 erschüttert Nordostjapan; Keine Tsunami-Warnung. Ein Erdbeben mit einer vorläufigen Stärke von 6,9 erschütterte am Donnerstag den Nordosten Japans, es wurde jedoch keine Tsunami-Warnung ausgegeben, teilte die Wetterbehörde mit. Das Beben um 7:30 Uhr hatte in der Präfektur Aomori eine Stärke von über 6 auf der japanischen seismischen Intensitätsskala von 7.","M6.9 quake hits northeastern Japan; no tsunami warning. An earthquake with a preliminary magnitude of 6.9 struck northeastern Japan on Thursday, but no tsunami warning was issued, the weather agency said. The 7:30 a.m. quake measured upper 6 on the Japanese seismic intensity scale of 7 in Aomori Prefecture.","M6.9 Iaponia septentrionales motus pervenit; non tsunami admonitio. Terrae motus cum magnitudine praeliminaria 6.9 Iaponiam septentrionalem die Iovis percussit, sed nulla tsunami admonitio prolata est, propellente tempestatem dixit. The 7:30 a.m. motus superiorum 6 in intensione seismica Iaponicae 7 in Praefecturae Aomori.",2026-06-26 10:38:37+00:00
95c17868ccbae566c2fa4ba6d569ecab,2026-06-24T23:53:59Z,'tsunami warning',www.channelnewsasia.com,en,0.9,"Magnitude 6.9 quake hits northern Japan, no tsunami warning","TOKYO: A magnitude 6.9 earthquake struck northern Japan on Thursday (Jun 25), the country's weather agency said, adding that there was no tsunami warning.There were no immediate reports of major damage.The quake occurred off the northern region of Iwate, with…",https://www.channelnewsasia.com/east-asia/japan-magnitude-69-earthquake-iwate-jun-25-6208341,"https://dam.mediacorp.sg/image/upload/s--4ic0fMFn--/c_crop,h_736,w_1308,x_132,y_0/c_fill,g_auto,h_676,w_1200/f_auto,q_auto/v1/mediacorp/cna/image/2026/06/25/japan_quake_jun_25_usgs.png?itok=oVQZN-mj",,"TOKYO: A magnitude 6.9 earthquake struck northern Japan on Thursday (Jun 25), the country's weather agency said, adding that there was no tsunami warning.
There were no immediate reports of major da… [+1382 chars]",,"Beben der Stärke 6,9 ​​erschüttert Nordjapan, keine Tsunami-Warnung. TOKIO: Ein Erdbeben der Stärke 6,9 ​​erschütterte am Donnerstag (25. Juni) den Norden Japans, teilte die Wetterbehörde des Landes mit und fügte hinzu, es gebe keine Tsunami-Warnung. Es gab keine unmittelbaren Berichte über größere Schäden. Das Beben ereignete sich vor der nördlichen Region Iwate, mit…","Magnitude 6.9 quake hits northern Japan, no tsunami warning. TOKYO: A magnitude 6.9 earthquake struck northern Japan on Thursday (Jun 25), the country's weather agency said, adding that there was no tsunami warning.There were no immediate reports of major damage.The quake occurred off the northern region of Iwate, with…","Magnitudo 6.9 motus Iaponiam septentrionalem attingit, nullum tsunami monitum. TOKYO: Magnitudo 6.9 terrae motus Iaponiam septentrionalem die Iovis (Ian. 25) concussit, tempestates patriae dixit, addens nihil tsunami monitum esse. Nullae proximi nuntii maioris detrimenti fuerunt. Motus inter septentrionalem plagam Iwate facta est, cum…",2026-06-26 10:38:37+00:00
0cdef15fe0da37b68e54b2efe78c7992,2026-06-25T02:49:36Z,'tsunami damages',economictimes.indiatimes.com,en,0.3,"Watch: Venezuela rocked by 2 deadly earthquakes within 39 seconds. Roads crack open, buildings shake & residents run in fear","Earthquake in Venezuela: Venezuela was jolted by two powerful earthquakes, a 7.2 magnitude followed by a 7.5 magnitude just 39 seconds later, causing building collapses and road damage. Viral videos show panicked residents fleeing structures and streets crack…",https://economictimes.indiatimes.com/news/new-updates/watch-venezuela-rocked-by-2-deadly-earthquakes-within-39-seconds-roads-crack-open-buildings-shake-residents-run-in-fear/articleshow/131980696.cms,"https://img.etimg.com/thumb/msid-131980700,width-1200,height-630,imgsize-254624,overlay-economictimes/articleshow.jpg",http://web.archive.org/web/20260625122239/https://economictimes.indiatimes.com/news/new-updates/watch-venezuela-rocked-by-2-deadly-earthquakes-within-39-seconds-roads-crack-open-buildings-shake-residents-run-in-fear/articleshow/131980696.cms,"Panic swept across parts of Venezuela after two powerful earthquakes struck within just 39 seconds of each other, triggering building collapses, road damage and tsunami alerts across the Caribbean re… [+4146 chars]",,"Anschauen: Venezuela wurde innerhalb von 39 Sekunden von zwei tödlichen Erdbeben erschüttert. Straßen brechen auf, Gebäude beben und Anwohner rennen vor Angst davon. Erdbeben in Venezuela: Venezuela wurde von zwei starken Erdbeben erschüttert, einem Erdbeben der Stärke 7,2, gefolgt von einem Erdbeben der Stärke 7,5 nur 39 Sekunden später, das zum Einsturz von Gebäuden und zu Straßenschäden führte. Virale Videos zeigen in Panik geratene Bewohner, die aus Gebäuden fliehen, und Straßen brechen zusammen …","Watch: Venezuela rocked by 2 deadly earthquakes within 39 seconds. Roads crack open, buildings shake & residents run in fear. Earthquake in Venezuela: Venezuela was jolted by two powerful earthquakes, a 7.2 magnitude followed by a 7.5 magnitude just 39 seconds later, causing building collapses and road damage. Viral videos show panicked residents fleeing structures and streets crack…","Vide: Venezuela a 2 terrae motibus internis XXXIX secundis agitata. Viae resiliunt, aedificia concutiunt & incolas metu currunt. Terrae motus in Venezuela: Venezuela duobus terrae motibus validis commotus est, 7.2 magnitudo consecuta est 7.5 magnitudine mox 39 secundis post, aedificium ruinas et damnum via causans. Virales videos incolas perterritos ostendere structuras et plateas fugientes resiliunt…",2026-06-27 09:50:29+00:00
